Using custom data configuration default-ef829ac6eac2e0f6
Reusing dataset csv (/home/peterr/.cache/huggingface/datasets/csv/default-ef829ac6eac2e0f6/0.0.0/433e0ccc46f9880962cc2b12065189766fbb2bee57a221866138fb9203c83519)
  0%|          | 0/2 [00:00<?, ?it/s]100%|██████████| 2/2 [00:00<00:00, 1101.59it/s]
/home/peterr/anaconda3/lib/python3.8/site-packages/transformers/models/wav2vec2/processing_wav2vec2.py:52: FutureWarning: Loading a tokenizer inside Wav2Vec2Processor from a config that does not include a `tokenizer_class` attribute is deprecated and will be removed in v5. Please add `'tokenizer_class': 'Wav2Vec2CTCTokenizer'` attribute to either your `config.json` or `tokenizer_config.json` file to suppress this warning: 
  warnings.warn(
Special tokens have been added in the vocabulary, make sure the associated word embeddings are fine-tuned or trained.
Loading cached processed dataset at /home/peterr/.cache/huggingface/datasets/csv/default-ef829ac6eac2e0f6/0.0.0/433e0ccc46f9880962cc2b12065189766fbb2bee57a221866138fb9203c83519/cache-2a8dfdb30c81ccd3.arrow
Loading cached processed dataset at /home/peterr/.cache/huggingface/datasets/csv/default-ef829ac6eac2e0f6/0.0.0/433e0ccc46f9880962cc2b12065189766fbb2bee57a221866138fb9203c83519/cache-5cf22dfb6d879f89.arrow
Loading cached processed dataset at /home/peterr/.cache/huggingface/datasets/csv/default-ef829ac6eac2e0f6/0.0.0/433e0ccc46f9880962cc2b12065189766fbb2bee57a221866138fb9203c83519/cache-86c62e2ab981f578.arrow
Loading cached processed dataset at /home/peterr/.cache/huggingface/datasets/csv/default-ef829ac6eac2e0f6/0.0.0/433e0ccc46f9880962cc2b12065189766fbb2bee57a221866138fb9203c83519/cache-f83a4b0c2b3494db.arrow
Loading cached processed dataset at /home/peterr/.cache/huggingface/datasets/csv/default-ef829ac6eac2e0f6/0.0.0/433e0ccc46f9880962cc2b12065189766fbb2bee57a221866138fb9203c83519/cache-90f4158ba66f1401.arrow
Loading cached processed dataset at /home/peterr/.cache/huggingface/datasets/csv/default-ef829ac6eac2e0f6/0.0.0/433e0ccc46f9880962cc2b12065189766fbb2bee57a221866138fb9203c83519/cache-ced48e95245fc45c.arrow
Loading cached processed dataset at /home/peterr/.cache/huggingface/datasets/csv/default-ef829ac6eac2e0f6/0.0.0/433e0ccc46f9880962cc2b12065189766fbb2bee57a221866138fb9203c83519/cache-8c83b537b47864d9.arrow
Loading cached processed dataset at /home/peterr/.cache/huggingface/datasets/csv/default-ef829ac6eac2e0f6/0.0.0/433e0ccc46f9880962cc2b12065189766fbb2bee57a221866138fb9203c83519/cache-fae9b432f02edca4.arrow
Some weights of the model checkpoint at facebook/wav2vec2-large were not used when initializing Wav2Vec2ForSpeechClassification: ['quantizer.codevectors', 'quantizer.weight_proj.bias', 'project_q.weight', 'project_hid.weight', 'project_hid.bias', 'project_q.bias', 'quantizer.weight_proj.weight']
- This IS expected if you are initializing Wav2Vec2ForSpeechClassification from the checkpoint of a model trained on another task or with another architecture (e.g. initializing a BertForSequenceClassification model from a BertForPreTraining model).
- This IS NOT expected if you are initializing Wav2Vec2ForSpeechClassification from the checkpoint of a model that you expect to be exactly identical (initializing a BertForSequenceClassification model from a BertForSequenceClassification model).
Some weights of Wav2Vec2ForSpeechClassification were not initialized from the model checkpoint at facebook/wav2vec2-large and are newly initialized: ['classifier.dense.bias', 'classifier.out_proj.bias', 'classifier.dense.weight', 'classifier.out_proj.weight']
You should probably TRAIN this model on a down-stream task to be able to use it for predictions and inference.
Using amp half precision backend
The following columns in the training set  don't have a corresponding argument in `Wav2Vec2ForSpeechClassification.forward` and have been ignored: Speaker_gender, path. If Speaker_gender, path are not expected by `Wav2Vec2ForSpeechClassification.forward`,  you can safely ignore this message.
/home/peterr/anaconda3/lib/python3.8/site-packages/transformers/optimization.py:306: FutureWarning: This implementation of AdamW is deprecated and will be removed in a future version. Use the PyTorch implementation torch.optim.AdamW instead, or set `no_deprecation_warning=True` to disable this warning
  warnings.warn(
***** Running training *****
  Num examples = 1000
  Num Epochs = 2
  Instantaneous batch size per device = 4
  Total train batch size (w. parallel, distributed & accumulation) = 8
  Gradient Accumulation steps = 2
  Total optimization steps = 250
Automatic Weights & Biases logging enabled, to disable set os.environ["WANDB_DISABLED"] = "true"
wandb: Currently logged in as: 5roop. Use `wandb login --relogin` to force relogin
A classification problem with 2 classes: ['F', 'M']
The target sampling rate: 16000
wandb: Tracking run with wandb version 0.12.16
wandb: Run data is saved locally in /home/peterr/macocu/task11/wandb/run-20220517_161922-bh84dpe3
wandb: Run `wandb offline` to turn off syncing.
wandb: Syncing run models/facebook_wav2vec2-large_NEW_GENDER_
wandb: ⭐️ View project at https://wandb.ai/5roop/huggingface
wandb: 🚀 View run at https://wandb.ai/5roop/huggingface/runs/bh84dpe3
  0% 0/250 [00:00<?, ?it/s]  0% 1/250 [00:02<09:58,  2.40s/it]  1% 2/250 [00:04<10:23,  2.51s/it]  1% 3/250 [00:07<10:18,  2.50s/it]  2% 4/250 [00:09<10:03,  2.45s/it]  2% 5/250 [00:12<10:15,  2.51s/it]  2% 6/250 [00:15<10:13,  2.52s/it]  3% 7/250 [00:17<10:00,  2.47s/it]  3% 8/250 [00:19<09:48,  2.43s/it]  4% 9/250 [00:22<09:57,  2.48s/it]  4% 10/250 [00:24<09:48,  2.45s/it]                                      4% 10/250 [00:24<09:48,  2.45s/it]  4% 11/250 [00:27<09:37,  2.42s/it]  5% 12/250 [00:29<09:42,  2.45s/it]  5% 13/250 [00:32<09:51,  2.50s/it]  6% 14/250 [00:34<10:03,  2.56s/it]  6% 15/250 [00:37<09:32,  2.43s/it]  6% 16/250 [00:39<09:26,  2.42s/it]  7% 17/250 [00:41<09:04,  2.34s/it]  7% 18/250 [00:43<09:09,  2.37s/it]  8% 19/250 [00:46<09:00,  2.34s/it]  8% 20/250 [00:49<09:28,  2.47s/it]                                      8% 20/250 [00:49<09:28,  2.47s/it]  8% 21/250 [00:51<09:40,  2.54s/it]  9% 22/250 [00:53<09:16,  2.44s/it]  9% 23/250 [00:56<09:32,  2.52s/it] 10% 24/250 [00:59<09:24,  2.50s/it] 10% 25/250 [01:01<09:32,  2.55s/it] 10% 26/250 [01:04<09:41,  2.60s/it] 11% 27/250 [01:07<09:35,  2.58s/it] 11% 28/250 [01:09<09:28,  2.56s/it] 12% 29/250 [01:12<09:30,  2.58s/it] 12% 30/250 [01:14<09:08,  2.49s/it]                                     12% 30/250 [01:14<09:08,  2.49s/it] 12% 31/250 [01:16<09:08,  2.50s/it] 13% 32/250 [01:19<08:55,  2.46s/it] 13% 33/250 [01:21<08:55,  2.47s/it] 14% 34/250 [01:24<08:50,  2.46s/it] 14% 35/250 [01:26<08:49,  2.46s/it] 14% 36/250 [01:29<08:51,  2.48s/it] 15% 37/250 [01:31<08:52,  2.50s/it] 15% 38/250 [01:34<08:35,  2.43s/it] 16% 39/250 [01:36<08:37,  2.45s/it] 16% 40/250 [01:38<08:28,  2.42s/it]                                     16% 40/250 [01:38<08:28,  2.42s/it] 16% 41/250 [01:41<08:41,  2.50s/it] 17% 42/250 [01:44<08:40,  2.50s/it] 17% 43/250 [01:46<08:26,  2.45s/it] 18% 44/250 [01:48<08:10,  2.38s/it] 18% 45/250 [01:50<07:57,  2.33s/it] 18% 46/250 [01:53<08:15,  2.43s/it] 19% 47/250 [01:55<08:01,  2.37s/it] 19% 48/250 [01:58<08:04,  2.40s/it] 20% 49/250 [02:00<07:58,  2.38s/it] 20% 50/250 [02:02<07:51,  2.36s/it]                                     20% 50/250 [02:02<07:51,  2.36s/it] 20% 51/250 [02:05<07:51,  2.37s/it] 21% 52/250 [02:07<07:47,  2.36s/it] 21% 53/250 [02:10<07:51,  2.40s/it] 22% 54/250 [02:12<08:03,  2.46s/it] 22% 55/250 [02:15<08:05,  2.49s/it] 22% 56/250 [02:17<08:09,  2.52s/it] 23% 57/250 [02:20<08:07,  2.52s/it] 23% 58/250 [02:23<08:15,  2.58s/it] 24% 59/250 [02:25<08:20,  2.62s/it] 24% 60/250 [02:28<07:54,  2.50s/it]                                     24% 60/250 [02:28<07:54,  2.50s/it] 24% 61/250 [02:30<07:59,  2.54s/it] 25% 62/250 [02:33<07:51,  2.51s/it] 25% 63/250 [02:35<07:52,  2.53s/it] 26% 64/250 [02:38<07:48,  2.52s/it] 26% 65/250 [02:40<07:36,  2.47s/it] 26% 66/250 [02:43<07:42,  2.52s/it] 27% 67/250 [02:45<07:38,  2.50s/it] 27% 68/250 [02:48<07:34,  2.50s/it] 28% 69/250 [02:50<07:31,  2.49s/it] 28% 70/250 [02:53<07:38,  2.55s/it]                                     28% 70/250 [02:53<07:38,  2.55s/it] 28% 71/250 [02:55<07:13,  2.42s/it] 29% 72/250 [02:57<07:20,  2.47s/it] 29% 73/250 [03:00<07:20,  2.49s/it] 30% 74/250 [03:02<07:07,  2.43s/it] 30% 75/250 [03:05<07:09,  2.45s/it] 30% 76/250 [03:07<06:54,  2.38s/it] 31% 77/250 [03:09<06:55,  2.40s/it] 31% 78/250 [03:12<06:54,  2.41s/it] 32% 79/250 [03:14<06:55,  2.43s/it] 32% 80/250 [03:17<06:55,  2.45s/it]                                     32% 80/250 [03:17<06:55,  2.45s/it] 32% 81/250 [03:19<06:54,  2.45s/it] 33% 82/250 [03:22<06:46,  2.42s/it] 33% 83/250 [03:24<06:38,  2.39s/it] 34% 84/250 [03:26<06:43,  2.43s/it] 34% 85/250 [03:29<06:56,  2.52s/it] 34% 86/250 [03:32<06:44,  2.47s/it] 35% 87/250 [03:34<06:55,  2.55s/it] 35% 88/250 [03:37<07:00,  2.59s/it] 36% 89/250 [03:40<06:56,  2.59s/it] 36% 90/250 [03:42<06:43,  2.52s/it]                                     36% 90/250 [03:42<06:43,  2.52s/it] 36% 91/250 [03:44<06:33,  2.48s/it] 37% 92/250 [03:47<06:29,  2.46s/it] 37% 93/250 [03:49<06:27,  2.47s/it] 38% 94/250 [03:52<06:20,  2.44s/it] 38% 95/250 [03:54<06:09,  2.38s/it] 38% 96/250 [03:56<06:18,  2.46s/it] 39% 97/250 [03:59<06:22,  2.50s/it] 39% 98/250 [04:02<06:30,  2.57s/it] 40% 99/250 [04:04<06:17,  2.50s/it] 40% 100/250 [04:07<06:15,  2.50s/it]                                      40% 100/250 [04:07<06:15,  2.50s/it]The following columns in the evaluation set  don't have a corresponding argument in `Wav2Vec2ForSpeechClassification.forward` and have been ignored: Speaker_gender, path. If Speaker_gender, path are not expected by `Wav2Vec2ForSpeechClassification.forward`,  you can safely ignore this message.
***** Running Evaluation *****
  Num examples = 2000
  Batch size = 4
{'loss': 0.728, 'learning_rate': 9.6e-05, 'epoch': 0.08}
{'loss': 0.7554, 'learning_rate': 9.200000000000001e-05, 'epoch': 0.16}
{'loss': 0.8103, 'learning_rate': 8.800000000000001e-05, 'epoch': 0.24}
{'loss': 0.7746, 'learning_rate': 8.4e-05, 'epoch': 0.32}
{'loss': 0.7849, 'learning_rate': 8e-05, 'epoch': 0.4}
{'loss': 0.7526, 'learning_rate': 7.6e-05, 'epoch': 0.48}
{'loss': 0.7023, 'learning_rate': 7.2e-05, 'epoch': 0.56}
{'loss': 0.7037, 'learning_rate': 6.800000000000001e-05, 'epoch': 0.64}
{'loss': 0.7003, 'learning_rate': 6.400000000000001e-05, 'epoch': 0.72}
{'loss': 0.718, 'learning_rate': 6e-05, 'epoch': 0.8}

  0% 0/500 [00:00<?, ?it/s][A
  0% 2/500 [00:00<03:47,  2.19it/s][A
  1% 3/500 [00:01<05:09,  1.60it/s][A
  1% 4/500 [00:02<05:53,  1.40it/s][A
  1% 5/500 [00:03<06:17,  1.31it/s][A
  1% 6/500 [00:04<06:49,  1.21it/s][A
  1% 7/500 [00:05<06:57,  1.18it/s][A
  2% 8/500 [00:06<07:11,  1.14it/s][A
  2% 9/500 [00:07<07:20,  1.12it/s][A
  2% 10/500 [00:08<07:28,  1.09it/s][A
  2% 11/500 [00:08<07:05,  1.15it/s][A
  2% 12/500 [00:09<07:16,  1.12it/s][A
  3% 13/500 [00:10<07:21,  1.10it/s][A
  3% 14/500 [00:11<07:26,  1.09it/s][A
  3% 15/500 [00:12<07:30,  1.08it/s][A
  3% 16/500 [00:13<07:31,  1.07it/s][A
  3% 17/500 [00:14<07:22,  1.09it/s][A
  4% 18/500 [00:15<07:21,  1.09it/s][A
  4% 19/500 [00:16<07:19,  1.10it/s][A
  4% 20/500 [00:17<06:59,  1.14it/s][A
  4% 21/500 [00:18<07:03,  1.13it/s][A
  4% 22/500 [00:19<07:13,  1.10it/s][A
  5% 23/500 [00:19<07:10,  1.11it/s][A
  5% 24/500 [00:20<07:14,  1.10it/s][A
  5% 25/500 [00:21<07:06,  1.11it/s][A
  5% 26/500 [00:22<06:42,  1.18it/s][A
  5% 27/500 [00:23<06:54,  1.14it/s][A
  6% 28/500 [00:24<06:38,  1.18it/s][A
  6% 29/500 [00:25<06:41,  1.17it/s][A
  6% 30/500 [00:25<06:40,  1.17it/s][A
  6% 31/500 [00:26<06:40,  1.17it/s][A
  6% 32/500 [00:27<06:38,  1.17it/s][A
  7% 33/500 [00:28<06:43,  1.16it/s][A
  7% 34/500 [00:29<06:44,  1.15it/s][A
  7% 35/500 [00:30<06:41,  1.16it/s][A
  7% 36/500 [00:31<06:39,  1.16it/s][A
  7% 37/500 [00:31<06:48,  1.13it/s][A
  8% 38/500 [00:32<06:57,  1.11it/s][A
  8% 39/500 [00:33<06:59,  1.10it/s][A
  8% 40/500 [00:34<06:26,  1.19it/s][A
  8% 41/500 [00:35<06:39,  1.15it/s][A
  8% 42/500 [00:36<06:46,  1.13it/s][A
  9% 43/500 [00:37<06:54,  1.10it/s][A
  9% 44/500 [00:38<06:45,  1.12it/s][A
  9% 45/500 [00:39<06:53,  1.10it/s][A
  9% 46/500 [00:39<06:33,  1.15it/s][A
  9% 47/500 [00:40<06:42,  1.12it/s][A
 10% 48/500 [00:41<06:48,  1.11it/s][A
 10% 49/500 [00:42<06:44,  1.11it/s][A
 10% 50/500 [00:43<06:39,  1.13it/s][A
 10% 51/500 [00:44<06:25,  1.17it/s][A
 10% 52/500 [00:45<06:26,  1.16it/s][A
 11% 53/500 [00:46<06:24,  1.16it/s][A
 11% 54/500 [00:46<05:41,  1.31it/s][A
 11% 55/500 [00:47<05:46,  1.28it/s][A
 11% 56/500 [00:48<06:01,  1.23it/s][A
 11% 57/500 [00:49<06:20,  1.16it/s][A
 12% 58/500 [00:50<06:28,  1.14it/s][A
 12% 59/500 [00:51<06:30,  1.13it/s][A
 12% 60/500 [00:51<06:13,  1.18it/s][A
 12% 61/500 [00:52<06:18,  1.16it/s][A
 12% 62/500 [00:53<06:23,  1.14it/s][A
 13% 63/500 [00:54<06:30,  1.12it/s][A
 13% 64/500 [00:55<06:29,  1.12it/s][A
 13% 65/500 [00:56<06:33,  1.11it/s][A
 13% 66/500 [00:57<06:36,  1.09it/s][A
 13% 67/500 [00:58<06:36,  1.09it/s][A
 14% 68/500 [00:59<06:38,  1.08it/s][A
 14% 69/500 [01:00<06:31,  1.10it/s][A
 14% 70/500 [01:01<06:30,  1.10it/s][A
 14% 71/500 [01:01<06:31,  1.09it/s][A
 14% 72/500 [01:02<06:32,  1.09it/s][A
 15% 73/500 [01:03<06:33,  1.09it/s][A
 15% 74/500 [01:04<06:36,  1.07it/s][A
 15% 75/500 [01:05<06:33,  1.08it/s][A
 15% 76/500 [01:06<06:09,  1.15it/s][A
 15% 77/500 [01:07<06:14,  1.13it/s][A
 16% 78/500 [01:08<06:14,  1.13it/s][A
 16% 79/500 [01:09<06:08,  1.14it/s][A
 16% 80/500 [01:09<06:04,  1.15it/s][A
 16% 81/500 [01:10<06:08,  1.14it/s][A
 16% 82/500 [01:11<06:13,  1.12it/s][A
 17% 83/500 [01:12<06:21,  1.09it/s][A
 17% 84/500 [01:13<05:57,  1.16it/s][A
 17% 85/500 [01:14<05:54,  1.17it/s][A
 17% 86/500 [01:15<06:06,  1.13it/s][A
 17% 87/500 [01:15<05:45,  1.20it/s][A
 18% 88/500 [01:16<05:47,  1.19it/s][A
 18% 89/500 [01:17<05:59,  1.14it/s][A
 18% 90/500 [01:18<06:03,  1.13it/s][A
 18% 91/500 [01:19<05:52,  1.16it/s][A
 18% 92/500 [01:20<05:30,  1.23it/s][A
 19% 93/500 [01:21<05:48,  1.17it/s][A
 19% 94/500 [01:22<05:57,  1.14it/s][A
 19% 95/500 [01:23<06:04,  1.11it/s][A
 19% 96/500 [01:23<06:04,  1.11it/s][A
 19% 97/500 [01:24<06:09,  1.09it/s][A
 20% 98/500 [01:25<06:12,  1.08it/s][A
 20% 99/500 [01:26<06:09,  1.09it/s][A
 20% 100/500 [01:27<06:02,  1.10it/s][A
 20% 101/500 [01:28<06:02,  1.10it/s][A
 20% 102/500 [01:29<06:01,  1.10it/s][A
 21% 103/500 [01:30<06:07,  1.08it/s][A
 21% 104/500 [01:31<05:59,  1.10it/s][A
 21% 105/500 [01:32<05:58,  1.10it/s][A
 21% 106/500 [01:32<05:37,  1.17it/s][A
 21% 107/500 [01:33<05:36,  1.17it/s][A
 22% 108/500 [01:34<05:33,  1.18it/s][A
 22% 109/500 [01:35<05:32,  1.17it/s][A
 22% 110/500 [01:36<05:26,  1.19it/s][A
 22% 111/500 [01:37<05:30,  1.18it/s][A
 22% 112/500 [01:38<05:42,  1.13it/s][A
 23% 113/500 [01:38<05:27,  1.18it/s][A
 23% 114/500 [01:39<05:35,  1.15it/s][A
 23% 115/500 [01:40<05:29,  1.17it/s][A
 23% 116/500 [01:41<05:34,  1.15it/s][A
 23% 117/500 [01:42<05:37,  1.14it/s][A
 24% 118/500 [01:43<05:42,  1.12it/s][A
 24% 119/500 [01:44<05:46,  1.10it/s][A
 24% 120/500 [01:45<05:45,  1.10it/s][A
 24% 121/500 [01:46<05:41,  1.11it/s][A
 24% 122/500 [01:47<05:44,  1.10it/s][A
 25% 123/500 [01:47<05:42,  1.10it/s][A
 25% 124/500 [01:48<05:37,  1.12it/s][A
 25% 125/500 [01:49<05:23,  1.16it/s][A
 25% 126/500 [01:50<05:20,  1.17it/s][A
 25% 127/500 [01:51<05:30,  1.13it/s][A
 26% 128/500 [01:52<05:27,  1.14it/s][A
 26% 129/500 [01:53<05:32,  1.12it/s][A
 26% 130/500 [01:54<05:37,  1.10it/s][A
 26% 131/500 [01:54<05:27,  1.13it/s][A
 26% 132/500 [01:55<05:35,  1.10it/s][A
 27% 133/500 [01:56<05:25,  1.13it/s][A
 27% 134/500 [01:57<05:22,  1.13it/s][A
 27% 135/500 [01:58<05:21,  1.13it/s][A
 27% 136/500 [01:59<05:12,  1.16it/s][A
 27% 137/500 [02:00<05:01,  1.20it/s][A
 28% 138/500 [02:00<04:44,  1.27it/s][A
 28% 139/500 [02:01<04:59,  1.20it/s][A
 28% 140/500 [02:02<05:00,  1.20it/s][A
 28% 141/500 [02:03<04:57,  1.21it/s][A
 28% 142/500 [02:04<05:00,  1.19it/s][A
 29% 143/500 [02:05<05:03,  1.18it/s][A
 29% 144/500 [02:05<05:02,  1.18it/s][A
 29% 145/500 [02:06<05:12,  1.14it/s][A
 29% 146/500 [02:07<05:11,  1.13it/s][A
 29% 147/500 [02:08<05:18,  1.11it/s][A
 30% 148/500 [02:09<05:13,  1.12it/s][A
 30% 149/500 [02:10<05:12,  1.12it/s][A
 30% 150/500 [02:11<05:06,  1.14it/s][A
 30% 151/500 [02:12<05:04,  1.15it/s][A
 30% 152/500 [02:13<05:04,  1.14it/s][A
 31% 153/500 [02:13<04:53,  1.18it/s][A
 31% 154/500 [02:14<04:51,  1.19it/s][A
 31% 155/500 [02:15<04:53,  1.18it/s][A
 31% 156/500 [02:16<04:41,  1.22it/s][A
 31% 157/500 [02:17<04:45,  1.20it/s][A
 32% 158/500 [02:18<04:54,  1.16it/s][A
 32% 159/500 [02:19<05:00,  1.14it/s][A
 32% 160/500 [02:19<05:06,  1.11it/s][A
 32% 161/500 [02:20<05:04,  1.11it/s][A
 32% 162/500 [02:21<04:58,  1.13it/s][A
 33% 163/500 [02:22<04:36,  1.22it/s][A
 33% 164/500 [02:23<04:36,  1.21it/s][A
 33% 165/500 [02:24<04:44,  1.18it/s][A
 33% 166/500 [02:25<04:49,  1.15it/s][A
 33% 167/500 [02:25<04:57,  1.12it/s][A
 34% 168/500 [02:26<04:44,  1.17it/s][A
 34% 169/500 [02:27<04:43,  1.17it/s][A
 34% 170/500 [02:28<04:50,  1.13it/s][A
 34% 171/500 [02:29<04:38,  1.18it/s][A
 34% 172/500 [02:30<04:46,  1.14it/s][A
 35% 173/500 [02:31<04:53,  1.11it/s][A
 35% 174/500 [02:32<04:57,  1.09it/s][A
 35% 175/500 [02:33<04:52,  1.11it/s][A
 35% 176/500 [02:33<04:42,  1.15it/s][A
 35% 177/500 [02:34<04:49,  1.12it/s][A
 36% 178/500 [02:35<04:43,  1.14it/s][A
 36% 179/500 [02:36<04:35,  1.16it/s][A
 36% 180/500 [02:37<04:35,  1.16it/s][A
 36% 181/500 [02:38<04:43,  1.13it/s][A
 36% 182/500 [02:39<04:51,  1.09it/s][A
 37% 183/500 [02:40<04:52,  1.08it/s][A
 37% 184/500 [02:40<04:27,  1.18it/s][A
 37% 185/500 [02:41<04:26,  1.18it/s][A
 37% 186/500 [02:42<04:29,  1.16it/s][A
 37% 187/500 [02:43<04:32,  1.15it/s][A
 38% 188/500 [02:44<04:37,  1.12it/s][A
 38% 189/500 [02:45<04:42,  1.10it/s][A
 38% 190/500 [02:46<04:35,  1.12it/s][A
 38% 191/500 [02:47<04:40,  1.10it/s][A
 38% 192/500 [02:48<04:40,  1.10it/s][A
 39% 193/500 [02:48<04:17,  1.19it/s][A
 39% 194/500 [02:49<04:17,  1.19it/s][A
 39% 195/500 [02:50<04:27,  1.14it/s][A
 39% 196/500 [02:51<04:26,  1.14it/s][A
 39% 197/500 [02:52<04:17,  1.18it/s][A
 40% 198/500 [02:53<04:21,  1.16it/s][A
 40% 199/500 [02:53<04:08,  1.21it/s][A
 40% 200/500 [02:54<04:00,  1.25it/s][A
 40% 201/500 [02:55<04:01,  1.24it/s][A
 40% 202/500 [02:56<04:14,  1.17it/s][A
 41% 203/500 [02:57<04:23,  1.13it/s][A
 41% 204/500 [02:58<04:20,  1.14it/s][A
 41% 205/500 [02:59<04:27,  1.10it/s][A
 41% 206/500 [03:00<04:30,  1.09it/s][A
 41% 207/500 [03:01<04:25,  1.10it/s][A
 42% 208/500 [03:01<04:26,  1.10it/s][A
 42% 209/500 [03:02<04:13,  1.15it/s][A
 42% 210/500 [03:03<04:17,  1.13it/s][A
 42% 211/500 [03:04<04:19,  1.11it/s][A
 42% 212/500 [03:05<04:23,  1.09it/s][A
 43% 213/500 [03:06<04:15,  1.12it/s][A
 43% 214/500 [03:07<04:19,  1.10it/s][A
 43% 215/500 [03:08<04:18,  1.10it/s][A
 43% 216/500 [03:09<04:19,  1.10it/s][A
 43% 217/500 [03:10<04:15,  1.11it/s][A
 44% 218/500 [03:10<04:05,  1.15it/s][A
 44% 219/500 [03:11<03:57,  1.18it/s][A
 44% 220/500 [03:12<03:54,  1.19it/s][A
 44% 221/500 [03:13<03:39,  1.27it/s][A
 44% 222/500 [03:13<03:42,  1.25it/s][A
 45% 223/500 [03:14<03:42,  1.25it/s][A
 45% 224/500 [03:15<03:54,  1.18it/s][A
 45% 225/500 [03:16<04:02,  1.13it/s][A
 45% 226/500 [03:17<04:01,  1.13it/s][A
 45% 227/500 [03:18<04:06,  1.11it/s][A
 46% 228/500 [03:19<03:52,  1.17it/s][A
 46% 229/500 [03:19<03:39,  1.23it/s][A
 46% 230/500 [03:20<03:46,  1.19it/s][A
 46% 231/500 [03:21<03:44,  1.20it/s][A
 46% 232/500 [03:22<03:51,  1.16it/s][A
 47% 233/500 [03:23<03:57,  1.12it/s][A
 47% 234/500 [03:24<03:55,  1.13it/s][A
 47% 235/500 [03:25<03:58,  1.11it/s][A
 47% 236/500 [03:26<03:44,  1.17it/s][A
 47% 237/500 [03:26<03:44,  1.17it/s][A
 48% 238/500 [03:27<03:51,  1.13it/s][A
 48% 239/500 [03:28<03:47,  1.15it/s][A
 48% 240/500 [03:29<03:52,  1.12it/s][A
 48% 241/500 [03:30<03:49,  1.13it/s][A
 48% 242/500 [03:31<03:49,  1.13it/s][A
 49% 243/500 [03:32<03:48,  1.12it/s][A
 49% 244/500 [03:33<03:43,  1.14it/s][A
 49% 245/500 [03:34<03:49,  1.11it/s][A
 49% 246/500 [03:35<03:50,  1.10it/s][A
 49% 247/500 [03:35<03:51,  1.09it/s][A
 50% 248/500 [03:36<03:52,  1.08it/s][A
 50% 249/500 [03:37<03:50,  1.09it/s][A
 50% 250/500 [03:38<03:47,  1.10it/s][A
 50% 251/500 [03:39<03:42,  1.12it/s][A
 50% 252/500 [03:40<03:32,  1.17it/s][A
 51% 253/500 [03:41<03:25,  1.20it/s][A
 51% 254/500 [03:41<03:27,  1.19it/s][A
 51% 255/500 [03:42<03:29,  1.17it/s][A
 51% 256/500 [03:43<03:27,  1.18it/s][A
 51% 257/500 [03:44<03:30,  1.16it/s][A
 52% 258/500 [03:45<03:27,  1.16it/s][A
 52% 259/500 [03:46<03:29,  1.15it/s][A
 52% 260/500 [03:47<03:21,  1.19it/s][A
 52% 261/500 [03:47<03:19,  1.20it/s][A
 52% 262/500 [03:48<03:20,  1.19it/s][A
 53% 263/500 [03:49<03:21,  1.17it/s][A
 53% 264/500 [03:50<03:23,  1.16it/s][A
 53% 265/500 [03:51<03:16,  1.19it/s][A
 53% 266/500 [03:52<03:22,  1.15it/s][A
 53% 267/500 [03:53<03:22,  1.15it/s][A
 54% 268/500 [03:53<03:15,  1.18it/s][A
 54% 269/500 [03:54<03:14,  1.19it/s][A
 54% 270/500 [03:55<03:21,  1.14it/s][A
 54% 271/500 [03:56<03:11,  1.20it/s][A
 54% 272/500 [03:57<03:12,  1.18it/s][A
 55% 273/500 [03:58<03:13,  1.17it/s][A
 55% 274/500 [03:59<03:10,  1.19it/s][A
 55% 275/500 [03:59<03:17,  1.14it/s][A
 55% 276/500 [04:00<03:09,  1.18it/s][A
 55% 277/500 [04:01<03:07,  1.19it/s][A
 56% 278/500 [04:02<03:12,  1.15it/s][A
 56% 279/500 [04:03<03:10,  1.16it/s][A
 56% 280/500 [04:04<03:16,  1.12it/s][A
 56% 281/500 [04:05<03:15,  1.12it/s][A
 56% 282/500 [04:06<03:14,  1.12it/s][A
 57% 283/500 [04:07<03:16,  1.10it/s][A
 57% 284/500 [04:07<03:10,  1.13it/s][A
 57% 285/500 [04:08<03:10,  1.13it/s][A
 57% 286/500 [04:09<03:07,  1.14it/s][A
 57% 287/500 [04:10<03:04,  1.15it/s][A
 58% 288/500 [04:11<03:04,  1.15it/s][A
 58% 289/500 [04:12<03:03,  1.15it/s][A
 58% 290/500 [04:13<02:59,  1.17it/s][A
 58% 291/500 [04:13<03:02,  1.14it/s][A
 58% 292/500 [04:14<03:06,  1.11it/s][A
 59% 293/500 [04:15<03:06,  1.11it/s][A
 59% 294/500 [04:16<03:08,  1.09it/s][A
 59% 295/500 [04:17<03:03,  1.12it/s][A
 59% 296/500 [04:18<03:02,  1.12it/s][A
 59% 297/500 [04:19<02:55,  1.15it/s][A
 60% 298/500 [04:20<02:51,  1.17it/s][A
 60% 299/500 [04:21<02:57,  1.13it/s][A
 60% 300/500 [04:22<03:01,  1.10it/s][A
 60% 301/500 [04:22<02:49,  1.17it/s][A
 60% 302/500 [04:23<02:50,  1.16it/s][A
 61% 303/500 [04:24<02:51,  1.15it/s][A
 61% 304/500 [04:25<02:44,  1.19it/s][A
 61% 305/500 [04:26<02:48,  1.16it/s][A
 61% 306/500 [04:27<02:45,  1.17it/s][A
 61% 307/500 [04:27<02:40,  1.20it/s][A
 62% 308/500 [04:28<02:45,  1.16it/s][A
 62% 309/500 [04:29<02:46,  1.15it/s][A
 62% 310/500 [04:30<02:48,  1.13it/s][A
 62% 311/500 [04:31<02:50,  1.11it/s][A
 62% 312/500 [04:32<02:50,  1.10it/s][A
 63% 313/500 [04:33<02:40,  1.16it/s][A
 63% 314/500 [04:34<02:39,  1.16it/s][A
 63% 315/500 [04:35<02:43,  1.13it/s][A
 63% 316/500 [04:35<02:47,  1.10it/s][A
 63% 317/500 [04:36<02:44,  1.11it/s][A
 64% 318/500 [04:37<02:35,  1.17it/s][A
 64% 319/500 [04:38<02:34,  1.17it/s][A
 64% 320/500 [04:39<02:32,  1.18it/s][A
 64% 321/500 [04:40<02:37,  1.13it/s][A
 64% 322/500 [04:41<02:37,  1.13it/s][A
 65% 323/500 [04:41<02:35,  1.14it/s][A
 65% 324/500 [04:42<02:25,  1.21it/s][A
 65% 325/500 [04:43<02:30,  1.16it/s][A
 65% 326/500 [04:44<02:31,  1.15it/s][A
 65% 327/500 [04:45<02:33,  1.13it/s][A
 66% 328/500 [04:46<02:30,  1.14it/s][A
 66% 329/500 [04:47<02:32,  1.12it/s][A
 66% 330/500 [04:48<02:30,  1.13it/s][A
 66% 331/500 [04:49<02:31,  1.12it/s][A
 66% 332/500 [04:49<02:32,  1.10it/s][A
 67% 333/500 [04:50<02:34,  1.08it/s][A
 67% 334/500 [04:51<02:35,  1.07it/s][A
 67% 335/500 [04:52<02:34,  1.06it/s][A
 67% 336/500 [04:53<02:32,  1.08it/s][A
 67% 337/500 [04:54<02:31,  1.07it/s][A
 68% 338/500 [04:55<02:25,  1.12it/s][A
 68% 339/500 [04:56<02:25,  1.11it/s][A
 68% 340/500 [04:57<02:25,  1.10it/s][A
 68% 341/500 [04:58<02:25,  1.09it/s][A
 68% 342/500 [04:59<02:21,  1.12it/s][A
 69% 343/500 [04:59<02:14,  1.17it/s][A
 69% 344/500 [05:00<02:07,  1.22it/s][A
 69% 345/500 [05:01<02:05,  1.23it/s][A
 69% 346/500 [05:02<02:10,  1.18it/s][A
 69% 347/500 [05:03<02:12,  1.15it/s][A
 70% 348/500 [05:04<02:12,  1.15it/s][A
 70% 349/500 [05:05<02:14,  1.12it/s][A
 70% 350/500 [05:06<02:16,  1.10it/s][A
 70% 351/500 [05:06<02:17,  1.08it/s][A
 70% 352/500 [05:07<02:17,  1.07it/s][A
 71% 353/500 [05:08<02:17,  1.07it/s][A
 71% 354/500 [05:09<02:16,  1.07it/s][A
 71% 355/500 [05:10<02:16,  1.07it/s][A
 71% 356/500 [05:11<02:11,  1.10it/s][A
 71% 357/500 [05:12<02:08,  1.11it/s][A
 72% 358/500 [05:13<02:07,  1.11it/s][A
 72% 359/500 [05:14<02:08,  1.09it/s][A
 72% 360/500 [05:15<02:08,  1.09it/s][A
 72% 361/500 [05:16<02:04,  1.11it/s][A
 72% 362/500 [05:16<02:02,  1.13it/s][A
 73% 363/500 [05:17<01:54,  1.19it/s][A
 73% 364/500 [05:18<01:58,  1.15it/s][A
 73% 365/500 [05:19<01:59,  1.13it/s][A
 73% 366/500 [05:20<02:00,  1.11it/s][A
 73% 367/500 [05:21<01:59,  1.11it/s][A
 74% 368/500 [05:22<02:00,  1.10it/s][A
 74% 369/500 [05:23<02:01,  1.08it/s][A
 74% 370/500 [05:24<01:54,  1.14it/s][A
 74% 371/500 [05:25<01:56,  1.11it/s][A
 74% 372/500 [05:25<01:51,  1.15it/s][A
 75% 373/500 [05:26<01:51,  1.14it/s][A
 75% 374/500 [05:27<01:51,  1.13it/s][A
 75% 375/500 [05:28<01:53,  1.10it/s][A
 75% 376/500 [05:29<01:53,  1.09it/s][A
 75% 377/500 [05:30<01:46,  1.15it/s][A
 76% 378/500 [05:31<01:43,  1.18it/s][A
 76% 379/500 [05:32<01:46,  1.13it/s][A
 76% 380/500 [05:32<01:48,  1.11it/s][A
 76% 381/500 [05:33<01:49,  1.09it/s][A
 76% 382/500 [05:34<01:48,  1.08it/s][A
 77% 383/500 [05:35<01:48,  1.08it/s][A
 77% 384/500 [05:36<01:46,  1.09it/s][A
 77% 385/500 [05:37<01:46,  1.08it/s][A
 77% 386/500 [05:38<01:43,  1.10it/s][A
 77% 387/500 [05:39<01:44,  1.08it/s][A
 78% 388/500 [05:40<01:38,  1.13it/s][A
 78% 389/500 [05:41<01:39,  1.12it/s][A
 78% 390/500 [05:42<01:37,  1.13it/s][A
 78% 391/500 [05:43<01:39,  1.10it/s][A
 78% 392/500 [05:43<01:35,  1.13it/s][A
 79% 393/500 [05:44<01:34,  1.14it/s][A
 79% 394/500 [05:45<01:35,  1.10it/s][A
 79% 395/500 [05:46<01:36,  1.09it/s][A
 79% 396/500 [05:47<01:33,  1.11it/s][A
 79% 397/500 [05:48<01:28,  1.16it/s][A
 80% 398/500 [05:49<01:30,  1.13it/s][A
 80% 399/500 [05:49<01:26,  1.16it/s][A
 80% 400/500 [05:50<01:25,  1.17it/s][A
 80% 401/500 [05:51<01:21,  1.21it/s][A
 80% 402/500 [05:52<01:24,  1.16it/s][A
 81% 403/500 [05:53<01:19,  1.23it/s][A
 81% 404/500 [05:54<01:16,  1.25it/s][A
 81% 405/500 [05:54<01:14,  1.28it/s][A
 81% 406/500 [05:55<01:13,  1.27it/s][A
 81% 407/500 [05:56<01:16,  1.22it/s][A
 82% 408/500 [05:57<01:11,  1.29it/s][A
 82% 409/500 [05:57<01:07,  1.35it/s][A
 82% 410/500 [05:58<01:08,  1.31it/s][A
 82% 411/500 [05:59<01:08,  1.30it/s][A
 82% 412/500 [06:00<01:05,  1.34it/s][A
 83% 413/500 [06:00<01:05,  1.34it/s][A
 83% 414/500 [06:01<01:06,  1.29it/s][A
 83% 415/500 [06:02<01:07,  1.25it/s][A
 83% 416/500 [06:03<01:08,  1.23it/s][A
 83% 417/500 [06:04<01:08,  1.21it/s][A
 84% 418/500 [06:05<01:09,  1.17it/s][A
 84% 419/500 [06:05<01:07,  1.20it/s][A
 84% 420/500 [06:06<01:02,  1.27it/s][A
 84% 421/500 [06:07<01:04,  1.23it/s][A
 84% 422/500 [06:08<01:00,  1.28it/s][A
 85% 423/500 [06:08<00:59,  1.29it/s][A
 85% 424/500 [06:09<00:58,  1.30it/s][A
 85% 425/500 [06:10<00:58,  1.29it/s][A
 85% 426/500 [06:11<00:57,  1.29it/s][A
 85% 427/500 [06:12<00:58,  1.25it/s][A
 86% 428/500 [06:13<00:59,  1.20it/s][A
 86% 429/500 [06:13<00:56,  1.25it/s][A
 86% 430/500 [06:14<00:57,  1.22it/s][A
 86% 431/500 [06:15<00:55,  1.24it/s][A
 86% 432/500 [06:16<00:53,  1.27it/s][A
 87% 433/500 [06:16<00:52,  1.27it/s][A
 87% 434/500 [06:17<00:49,  1.35it/s][A
 87% 435/500 [06:18<00:48,  1.35it/s][A
 87% 436/500 [06:19<00:49,  1.30it/s][A
 87% 437/500 [06:19<00:48,  1.30it/s][A
 88% 438/500 [06:20<00:49,  1.26it/s][A
 88% 439/500 [06:21<00:45,  1.33it/s][A
 88% 440/500 [06:22<00:47,  1.27it/s][A
 88% 441/500 [06:22<00:42,  1.39it/s][A
 88% 442/500 [06:23<00:43,  1.32it/s][A
 89% 443/500 [06:24<00:43,  1.31it/s][A
 89% 444/500 [06:25<00:44,  1.26it/s][A
 89% 445/500 [06:26<00:45,  1.20it/s][A
 89% 446/500 [06:26<00:42,  1.27it/s][A
 89% 447/500 [06:27<00:40,  1.30it/s][A
 90% 448/500 [06:28<00:37,  1.38it/s][A
 90% 449/500 [06:29<00:38,  1.33it/s][A
 90% 450/500 [06:29<00:39,  1.26it/s][A
 90% 451/500 [06:30<00:39,  1.25it/s][A
 90% 452/500 [06:31<00:40,  1.19it/s][A
 91% 453/500 [06:32<00:40,  1.15it/s][A
 91% 454/500 [06:33<00:39,  1.16it/s][A
 91% 455/500 [06:34<00:40,  1.12it/s][A
 91% 456/500 [06:35<00:40,  1.10it/s][A
 91% 457/500 [06:36<00:39,  1.09it/s][A
 92% 458/500 [06:37<00:37,  1.11it/s][A
 92% 459/500 [06:38<00:36,  1.11it/s][A
 92% 460/500 [06:39<00:35,  1.11it/s][A
 92% 461/500 [06:39<00:35,  1.09it/s][A
 92% 462/500 [06:40<00:34,  1.11it/s][A
 93% 463/500 [06:41<00:31,  1.17it/s][A
 93% 464/500 [06:42<00:30,  1.19it/s][A
 93% 465/500 [06:43<00:29,  1.17it/s][A
 93% 466/500 [06:44<00:28,  1.18it/s][A
 93% 467/500 [06:45<00:29,  1.14it/s][A
 94% 468/500 [06:45<00:28,  1.14it/s][A
 94% 469/500 [06:46<00:27,  1.14it/s][A
 94% 470/500 [06:47<00:26,  1.12it/s][A
 94% 471/500 [06:48<00:26,  1.10it/s][A
 94% 472/500 [06:49<00:25,  1.09it/s][A
 95% 473/500 [06:50<00:25,  1.07it/s][A
 95% 474/500 [06:51<00:23,  1.08it/s][A
 95% 475/500 [06:52<00:23,  1.09it/s][A
 95% 476/500 [06:53<00:22,  1.07it/s][A
 95% 477/500 [06:54<00:20,  1.12it/s][A
 96% 478/500 [06:55<00:19,  1.12it/s][A
 96% 479/500 [06:55<00:18,  1.14it/s][A
 96% 480/500 [06:56<00:17,  1.13it/s][A
 96% 481/500 [06:57<00:16,  1.13it/s][A
 96% 482/500 [06:58<00:16,  1.11it/s][A
 97% 483/500 [06:59<00:15,  1.10it/s][A
 97% 484/500 [07:00<00:13,  1.16it/s][A
 97% 485/500 [07:01<00:13,  1.12it/s][A
 97% 486/500 [07:02<00:12,  1.15it/s][A
 97% 487/500 [07:02<00:11,  1.15it/s][A
 98% 488/500 [07:03<00:10,  1.16it/s][A
 98% 489/500 [07:04<00:09,  1.20it/s][A
 98% 490/500 [07:05<00:08,  1.22it/s][A
 98% 491/500 [07:06<00:07,  1.19it/s][A
 98% 492/500 [07:07<00:06,  1.19it/s][A
 99% 493/500 [07:07<00:05,  1.18it/s][A
 99% 494/500 [07:08<00:05,  1.18it/s][A
 99% 495/500 [07:09<00:04,  1.16it/s][A
 99% 496/500 [07:10<00:03,  1.13it/s][A
 99% 497/500 [07:11<00:02,  1.10it/s][A
100% 498/500 [07:12<00:01,  1.13it/s][A
100% 499/500 [07:13<00:00,  1.11it/s][A
100% 500/500 [07:14<00:00,  1.09it/s][A                                     
                                     [A 40% 100/250 [11:22<06:15,  2.50s/it]
100% 500/500 [07:14<00:00,  1.09it/s][A
                                     [A 40% 101/250 [11:24<5:30:29, 133.08s/it] 41% 102/250 [11:27<3:51:30, 93.86s/it]  41% 103/250 [11:29<2:42:44, 66.42s/it] 42% 104/250 [11:31<1:54:47, 47.17s/it] 42% 105/250 [11:34<1:21:39, 33.79s/it] 42% 106/250 [11:36<58:08, 24.23s/it]   43% 107/250 [11:38<42:08, 17.69s/it] 43% 108/250 [11:40<30:50, 13.03s/it] 44% 109/250 [11:43<23:03,  9.81s/it] 44% 110/250 [11:45<17:39,  7.57s/it]                                      44% 110/250 [11:45<17:39,  7.57s/it] 44% 111/250 [11:48<13:55,  6.01s/it] 45% 112/250 [11:50<11:29,  5.00s/it] 45% 113/250 [11:53<09:39,  4.23s/it] 46% 114/250 [11:55<08:25,  3.72s/it] 46% 115/250 [11:57<07:20,  3.26s/it] 46% 116/250 [12:00<06:50,  3.06s/it] 47% 117/250 [12:03<06:30,  2.94s/it] 47% 118/250 [12:05<06:01,  2.74s/it] 48% 119/250 [12:07<05:39,  2.59s/it] 48% 120/250 [12:09<05:23,  2.49s/it]                                      48% 120/250 [12:09<05:23,  2.49s/it] 48% 121/250 [12:12<05:18,  2.47s/it] 49% 122/250 [12:14<05:26,  2.55s/it] 49% 123/250 [12:17<05:13,  2.47s/it] 50% 124/250 [12:19<05:08,  2.44s/it] 50% 125/250 [12:21<04:57,  2.38s/it]Saving model checkpoint to models/facebook_wav2vec2-large_NEW_GENDER_/checkpoint-125
Configuration saved in models/facebook_wav2vec2-large_NEW_GENDER_/checkpoint-125/config.json
Model weights saved in models/facebook_wav2vec2-large_NEW_GENDER_/checkpoint-125/pytorch_model.bin
Feature extractor saved in models/facebook_wav2vec2-large_NEW_GENDER_/checkpoint-125/preprocessor_config.json
 50% 126/250 [12:29<07:57,  3.85s/it] 51% 127/250 [12:31<07:09,  3.50s/it] 51% 128/250 [12:34<06:28,  3.18s/it] 52% 129/250 [12:36<05:56,  2.95s/it] 52% 130/250 [12:39<05:39,  2.83s/it]                                      52% 130/250 [12:39<05:39,  2.83s/it] 52% 131/250 [12:41<05:19,  2.68s/it] 53% 132/250 [12:44<05:10,  2.64s/it] 53% 133/250 [12:46<04:58,  2.55s/it] 54% 134/250 [12:48<04:53,  2.53s/it] 54% 135/250 [12:51<04:59,  2.60s/it] 54% 136/250 [12:53<04:44,  2.49s/it] 55% 137/250 [12:56<04:40,  2.48s/it] 55% 138/250 [12:58<04:35,  2.46s/it] 56% 139/250 [13:01<04:34,  2.47s/it] 56% 140/250 [13:03<04:34,  2.50s/it]                                      56% 140/250 [13:03<04:34,  2.50s/it] 56% 141/250 [13:06<04:27,  2.46s/it] 57% 142/250 [13:08<04:26,  2.46s/it] 57% 143/250 [13:11<04:21,  2.44s/it] 58% 144/250 [13:13<04:19,  2.45s/it] 58% 145/250 [13:16<04:20,  2.48s/it] 58% 146/250 [13:18<04:16,  2.47s/it] 59% 147/250 [13:21<04:15,  2.48s/it] 59% 148/250 [13:23<04:09,  2.45s/it] 60% 149/250 [13:25<04:08,  2.46s/it] 60% 150/250 [13:28<04:08,  2.48s/it]                                      60% 150/250 [13:28<04:08,  2.48s/it] 60% 151/250 [13:31<04:09,  2.52s/it] 61% 152/250 [13:33<03:50,  2.36s/it] 61% 153/250 [13:35<03:50,  2.38s/it] 62% 154/250 [13:37<03:48,  2.38s/it] 62% 155/250 [13:40<03:48,  2.41s/it] 62% 156/250 [13:42<03:41,  2.36s/it] 63% 157/250 [13:44<03:36,  2.33s/it] 63% 158/250 [13:47<03:44,  2.44s/it] 64% 159/250 [13:49<03:34,  2.36s/it] 64% 160/250 [13:52<03:34,  2.38s/it]                                      64% 160/250 [13:52<03:34,  2.38s/it] 64% 161/250 [13:54<03:35,  2.42s/it] 65% 162/250 [13:57<03:33,  2.43s/it] 65% 163/250 [13:59<03:29,  2.40s/it] 66% 164/250 [14:01<03:22,  2.36s/it] 66% 165/250 [14:04<03:25,  2.41s/it] 66% 166/250 [14:06<03:28,  2.48s/it] 67% 167/250 [14:08<03:14,  2.34s/it] 67% 168/250 [14:11<03:08,  2.30s/it] 68% 169/250 [14:13<03:10,  2.35s/it] 68% 170/250 [14:15<03:09,  2.37s/it]                                      68% 170/250 [14:15<03:09,  2.37s/it] 68% 171/250 [14:18<03:11,  2.43s/it] 69% 172/250 [14:20<03:06,  2.39s/it] 69% 173/250 [14:23<03:07,  2.43s/it] 70% 174/250 [14:25<02:58,  2.35s/it] 70% 175/250 [14:28<03:00,  2.40s/it] 70% 176/250 [14:30<03:04,  2.49s/it] 71% 177/250 [14:33<03:00,  2.48s/it] 71% 178/250 [14:35<02:51,  2.38s/it] 72% 179/250 [14:37<02:46,  2.35s/it] 72% 180/250 [14:39<02:44,  2.34s/it]                                      72% 180/250 [14:39<02:44,  2.34s/it] 72% 181/250 [14:42<02:41,  2.34s/it] 73% 182/250 [14:44<02:40,  2.36s/it] 73% 183/250 [14:47<02:37,  2.35s/it] 74% 184/250 [14:49<02:39,  2.41s/it] 74% 185/250 [14:51<02:34,  2.37s/it] 74% 186/250 [14:54<02:32,  2.38s/it] 75% 187/250 [14:56<02:34,  2.45s/it] 75% 188/250 [14:59<02:35,  2.51s/it] 76% 189/250 [15:01<02:32,  2.50s/it] 76% 190/250 [15:04<02:26,  2.43s/it]                                      76% 190/250 [15:04<02:26,  2.43s/it] 76% 191/250 [15:06<02:16,  2.32s/it] 77% 192/250 [15:08<02:18,  2.40s/it] 77% 193/250 [15:11<02:19,  2.44s/it] 78% 194/250 [15:13<02:18,  2.47s/it] 78% 195/250 [15:16<02:12,  2.40s/it] 78% 196/250 [15:18<02:10,  2.42s/it] 79% 197/250 [15:20<02:06,  2.39s/it] 79% 198/250 [15:23<02:04,  2.40s/it] 80% 199/250 [15:26<02:06,  2.48s/it] 80% 200/250 [15:28<02:01,  2.42s/it]                                      80% 200/250 [15:28<02:01,  2.42s/it]The following columns in the evaluation set  don't have a corresponding argument in `Wav2Vec2ForSpeechClassification.forward` and have been ignored: Speaker_gender, path. If Speaker_gender, path are not expected by `Wav2Vec2ForSpeechClassification.forward`,  you can safely ignore this message.
***** Running Evaluation *****
  Num examples = 2000
  Batch size = 4
{'eval_loss': 0.7257867455482483, 'eval_accuracy': 0.5, 'eval_runtime': 435.3325, 'eval_samples_per_second': 4.594, 'eval_steps_per_second': 1.149, 'epoch': 0.8}
{'loss': 0.6773, 'learning_rate': 5.6000000000000006e-05, 'epoch': 0.88}
{'loss': 0.7713, 'learning_rate': 5.2000000000000004e-05, 'epoch': 0.96}
{'loss': 0.6782, 'learning_rate': 4.8e-05, 'epoch': 1.04}
{'loss': 0.722, 'learning_rate': 4.4000000000000006e-05, 'epoch': 1.12}
{'loss': 0.6991, 'learning_rate': 4e-05, 'epoch': 1.2}
{'loss': 0.6827, 'learning_rate': 3.6e-05, 'epoch': 1.28}
{'loss': 0.7155, 'learning_rate': 3.2000000000000005e-05, 'epoch': 1.36}
{'loss': 0.7086, 'learning_rate': 2.8000000000000003e-05, 'epoch': 1.44}
{'loss': 0.735, 'learning_rate': 2.4e-05, 'epoch': 1.52}
{'loss': 0.6783, 'learning_rate': 2e-05, 'epoch': 1.6}

  0% 0/500 [00:00<?, ?it/s][A
  0% 2/500 [00:00<03:47,  2.19it/s][A
  1% 3/500 [00:01<05:08,  1.61it/s][A
  1% 4/500 [00:02<05:51,  1.41it/s][A
  1% 5/500 [00:03<06:20,  1.30it/s][A
  1% 6/500 [00:04<06:48,  1.21it/s][A
  1% 7/500 [00:05<06:54,  1.19it/s][A
  2% 8/500 [00:06<07:07,  1.15it/s][A
  2% 9/500 [00:07<07:13,  1.13it/s][A
  2% 10/500 [00:08<07:21,  1.11it/s][A
  2% 11/500 [00:08<07:00,  1.16it/s][A
  2% 12/500 [00:09<07:12,  1.13it/s][A
  3% 13/500 [00:10<07:19,  1.11it/s][A
  3% 14/500 [00:11<07:22,  1.10it/s][A
  3% 15/500 [00:12<07:26,  1.09it/s][A
  3% 16/500 [00:13<07:27,  1.08it/s][A
  3% 17/500 [00:14<07:18,  1.10it/s][A
  4% 18/500 [00:15<07:17,  1.10it/s][A
  4% 19/500 [00:16<07:14,  1.11it/s][A
  4% 20/500 [00:16<06:53,  1.16it/s][A
  4% 21/500 [00:17<06:59,  1.14it/s][A
  4% 22/500 [00:18<07:08,  1.11it/s][A
  5% 23/500 [00:19<07:07,  1.12it/s][A
  5% 24/500 [00:20<07:11,  1.10it/s][A
  5% 25/500 [00:21<07:04,  1.12it/s][A
  5% 26/500 [00:22<06:40,  1.18it/s][A
  5% 27/500 [00:23<06:52,  1.15it/s][A
  6% 28/500 [00:23<06:33,  1.20it/s][A
  6% 29/500 [00:24<06:37,  1.19it/s][A
  6% 30/500 [00:25<06:36,  1.19it/s][A
  6% 31/500 [00:26<06:37,  1.18it/s][A
  6% 32/500 [00:27<06:33,  1.19it/s][A
  7% 33/500 [00:28<06:38,  1.17it/s][A
  7% 34/500 [00:29<06:38,  1.17it/s][A
  7% 35/500 [00:29<06:36,  1.17it/s][A
  7% 36/500 [00:30<06:37,  1.17it/s][A
  7% 37/500 [00:31<06:47,  1.14it/s][A
  8% 38/500 [00:32<06:54,  1.11it/s][A
  8% 39/500 [00:33<06:56,  1.11it/s][A
  8% 40/500 [00:34<06:23,  1.20it/s][A
  8% 41/500 [00:35<06:37,  1.15it/s][A
  8% 42/500 [00:36<06:43,  1.14it/s][A
  9% 43/500 [00:37<06:51,  1.11it/s][A
  9% 44/500 [00:37<06:41,  1.14it/s][A
  9% 45/500 [00:38<06:48,  1.11it/s][A
  9% 46/500 [00:39<06:28,  1.17it/s][A
  9% 47/500 [00:40<06:37,  1.14it/s][A
 10% 48/500 [00:41<06:43,  1.12it/s][A
 10% 49/500 [00:42<06:40,  1.13it/s][A
 10% 50/500 [00:43<06:34,  1.14it/s][A
 10% 51/500 [00:43<06:20,  1.18it/s][A
 10% 52/500 [00:44<06:21,  1.17it/s][A
 11% 53/500 [00:45<06:19,  1.18it/s][A
 11% 54/500 [00:46<05:40,  1.31it/s][A
 11% 55/500 [00:47<05:43,  1.29it/s][A
 11% 56/500 [00:47<05:58,  1.24it/s][A
 11% 57/500 [00:48<06:19,  1.17it/s][A
 12% 58/500 [00:49<06:27,  1.14it/s][A
 12% 59/500 [00:50<06:29,  1.13it/s][A
 12% 60/500 [00:51<06:13,  1.18it/s][A
 12% 61/500 [00:52<06:17,  1.16it/s][A
 12% 62/500 [00:53<06:21,  1.15it/s][A
 13% 63/500 [00:54<06:30,  1.12it/s][A
 13% 64/500 [00:55<06:27,  1.13it/s][A
 13% 65/500 [00:55<06:29,  1.12it/s][A
 13% 66/500 [00:56<06:33,  1.10it/s][A
 13% 67/500 [00:57<06:35,  1.09it/s][A
 14% 68/500 [00:58<06:38,  1.08it/s][A
 14% 69/500 [00:59<06:30,  1.10it/s][A
 14% 70/500 [01:00<06:29,  1.10it/s][A
 14% 71/500 [01:01<06:29,  1.10it/s][A
 14% 72/500 [01:02<06:31,  1.09it/s][A
 15% 73/500 [01:03<06:31,  1.09it/s][A
 15% 74/500 [01:04<06:34,  1.08it/s][A
 15% 75/500 [01:05<06:30,  1.09it/s][A
 15% 76/500 [01:05<06:06,  1.16it/s][A
 15% 77/500 [01:06<06:10,  1.14it/s][A
 16% 78/500 [01:07<06:10,  1.14it/s][A
 16% 79/500 [01:08<06:05,  1.15it/s][A
 16% 80/500 [01:09<06:03,  1.16it/s][A
 16% 81/500 [01:10<06:07,  1.14it/s][A
 16% 82/500 [01:11<06:14,  1.12it/s][A
 17% 83/500 [01:12<06:20,  1.10it/s][A
 17% 84/500 [01:12<05:56,  1.17it/s][A
 17% 85/500 [01:13<05:52,  1.18it/s][A
 17% 86/500 [01:14<06:03,  1.14it/s][A
 17% 87/500 [01:15<05:43,  1.20it/s][A
 18% 88/500 [01:16<05:44,  1.20it/s][A
 18% 89/500 [01:17<05:55,  1.16it/s][A
 18% 90/500 [01:18<06:00,  1.14it/s][A
 18% 91/500 [01:18<05:49,  1.17it/s][A
 18% 92/500 [01:19<05:28,  1.24it/s][A
 19% 93/500 [01:20<05:43,  1.18it/s][A
 19% 94/500 [01:21<05:52,  1.15it/s][A
 19% 95/500 [01:22<06:00,  1.12it/s][A
 19% 96/500 [01:23<06:02,  1.11it/s][A
 19% 97/500 [01:24<06:07,  1.10it/s][A
 20% 98/500 [01:25<06:09,  1.09it/s][A
 20% 99/500 [01:26<06:04,  1.10it/s][A
 20% 100/500 [01:26<05:56,  1.12it/s][A
 20% 101/500 [01:27<05:55,  1.12it/s][A
 20% 102/500 [01:28<05:56,  1.12it/s][A
 21% 103/500 [01:29<06:01,  1.10it/s][A
 21% 104/500 [01:30<05:55,  1.11it/s][A
 21% 105/500 [01:31<05:50,  1.13it/s][A
 21% 106/500 [01:32<05:31,  1.19it/s][A
 21% 107/500 [01:32<05:31,  1.19it/s][A
 22% 108/500 [01:33<05:28,  1.19it/s][A
 22% 109/500 [01:34<05:27,  1.19it/s][A
 22% 110/500 [01:35<05:21,  1.21it/s][A
 22% 111/500 [01:36<05:26,  1.19it/s][A
 22% 112/500 [01:37<05:37,  1.15it/s][A
 23% 113/500 [01:38<05:22,  1.20it/s][A
 23% 114/500 [01:38<05:30,  1.17it/s][A
 23% 115/500 [01:39<05:25,  1.18it/s][A
 23% 116/500 [01:40<05:31,  1.16it/s][A
 23% 117/500 [01:41<05:32,  1.15it/s][A
 24% 118/500 [01:42<05:37,  1.13it/s][A
 24% 119/500 [01:43<05:43,  1.11it/s][A
 24% 120/500 [01:44<05:43,  1.11it/s][A
 24% 121/500 [01:45<05:41,  1.11it/s][A
 24% 122/500 [01:46<05:46,  1.09it/s][A
 25% 123/500 [01:47<05:48,  1.08it/s][A
 25% 124/500 [01:47<05:40,  1.10it/s][A
 25% 125/500 [01:48<05:25,  1.15it/s][A
 25% 126/500 [01:49<05:20,  1.17it/s][A
 25% 127/500 [01:50<05:29,  1.13it/s][A
 26% 128/500 [01:51<05:25,  1.14it/s][A
 26% 129/500 [01:52<05:28,  1.13it/s][A
 26% 130/500 [01:53<05:33,  1.11it/s][A
 26% 131/500 [01:54<05:23,  1.14it/s][A
 26% 132/500 [01:54<05:30,  1.11it/s][A
 27% 133/500 [01:55<05:20,  1.15it/s][A
 27% 134/500 [01:56<05:20,  1.14it/s][A
 27% 135/500 [01:57<05:17,  1.15it/s][A
 27% 136/500 [01:58<05:07,  1.18it/s][A
 27% 137/500 [01:59<04:57,  1.22it/s][A
 28% 138/500 [01:59<04:41,  1.28it/s][A
 28% 139/500 [02:00<04:57,  1.21it/s][A
 28% 140/500 [02:01<04:57,  1.21it/s][A
 28% 141/500 [02:02<04:53,  1.22it/s][A
 28% 142/500 [02:03<04:56,  1.21it/s][A
 29% 143/500 [02:04<04:58,  1.20it/s][A
 29% 144/500 [02:04<04:58,  1.19it/s][A
 29% 145/500 [02:05<05:08,  1.15it/s][A
 29% 146/500 [02:06<05:07,  1.15it/s][A
 29% 147/500 [02:07<05:12,  1.13it/s][A
 30% 148/500 [02:08<05:06,  1.15it/s][A
 30% 149/500 [02:09<05:05,  1.15it/s][A
 30% 150/500 [02:10<05:00,  1.17it/s][A
 30% 151/500 [02:10<04:58,  1.17it/s][A
 30% 152/500 [02:11<04:59,  1.16it/s][A
 31% 153/500 [02:12<04:48,  1.20it/s][A
 31% 154/500 [02:13<04:45,  1.21it/s][A
 31% 155/500 [02:14<04:48,  1.19it/s][A
 31% 156/500 [02:15<04:37,  1.24it/s][A
 31% 157/500 [02:15<04:39,  1.23it/s][A
 32% 158/500 [02:16<04:50,  1.18it/s][A
 32% 159/500 [02:17<04:55,  1.15it/s][A
 32% 160/500 [02:18<05:02,  1.12it/s][A
 32% 161/500 [02:19<04:58,  1.14it/s][A
 32% 162/500 [02:20<04:53,  1.15it/s][A
 33% 163/500 [02:21<04:32,  1.24it/s][A
 33% 164/500 [02:21<04:31,  1.24it/s][A
 33% 165/500 [02:22<04:39,  1.20it/s][A
 33% 166/500 [02:23<04:45,  1.17it/s][A
 33% 167/500 [02:24<04:53,  1.13it/s][A
 34% 168/500 [02:25<04:41,  1.18it/s][A
 34% 169/500 [02:26<04:39,  1.19it/s][A
 34% 170/500 [02:27<04:46,  1.15it/s][A
 34% 171/500 [02:27<04:34,  1.20it/s][A
 34% 172/500 [02:28<04:40,  1.17it/s][A
 35% 173/500 [02:29<04:47,  1.14it/s][A
 35% 174/500 [02:30<04:51,  1.12it/s][A
 35% 175/500 [02:31<04:47,  1.13it/s][A
 35% 176/500 [02:32<04:37,  1.17it/s][A
 35% 177/500 [02:33<04:45,  1.13it/s][A
 36% 178/500 [02:34<04:39,  1.15it/s][A
 36% 179/500 [02:34<04:30,  1.18it/s][A
 36% 180/500 [02:35<04:31,  1.18it/s][A
 36% 181/500 [02:36<04:39,  1.14it/s][A
 36% 182/500 [02:37<04:45,  1.11it/s][A
 37% 183/500 [02:38<04:46,  1.10it/s][A
 37% 184/500 [02:39<04:22,  1.20it/s][A
 37% 185/500 [02:39<04:21,  1.21it/s][A
 37% 186/500 [02:40<04:24,  1.19it/s][A
 37% 187/500 [02:41<04:27,  1.17it/s][A
 38% 188/500 [02:42<04:34,  1.14it/s][A
 38% 189/500 [02:43<04:37,  1.12it/s][A
 38% 190/500 [02:44<04:31,  1.14it/s][A
 38% 191/500 [02:45<04:37,  1.11it/s][A
 38% 192/500 [02:46<04:37,  1.11it/s][A
 39% 193/500 [02:46<04:14,  1.21it/s][A
 39% 194/500 [02:47<04:14,  1.20it/s][A
 39% 195/500 [02:48<04:24,  1.15it/s][A
 39% 196/500 [02:49<04:23,  1.16it/s][A
 39% 197/500 [02:50<04:14,  1.19it/s][A
 40% 198/500 [02:51<04:18,  1.17it/s][A
 40% 199/500 [02:52<04:06,  1.22it/s][A
 40% 200/500 [02:52<03:57,  1.26it/s][A
 40% 201/500 [02:53<03:57,  1.26it/s][A
 40% 202/500 [02:54<04:12,  1.18it/s][A
 41% 203/500 [02:55<04:22,  1.13it/s][A
 41% 204/500 [02:56<04:19,  1.14it/s][A
 41% 205/500 [02:57<04:24,  1.11it/s][A
 41% 206/500 [02:58<04:26,  1.10it/s][A
 41% 207/500 [02:59<04:22,  1.12it/s][A
 42% 208/500 [03:00<04:23,  1.11it/s][A
 42% 209/500 [03:00<04:11,  1.16it/s][A
 42% 210/500 [03:01<04:15,  1.14it/s][A
 42% 211/500 [03:02<04:16,  1.13it/s][A
 42% 212/500 [03:03<04:20,  1.11it/s][A
 43% 213/500 [03:04<04:14,  1.13it/s][A
 43% 214/500 [03:05<04:18,  1.11it/s][A
 43% 215/500 [03:06<04:16,  1.11it/s][A
 43% 216/500 [03:07<04:18,  1.10it/s][A
 43% 217/500 [03:08<04:13,  1.12it/s][A
 44% 218/500 [03:08<04:03,  1.16it/s][A
 44% 219/500 [03:09<03:54,  1.20it/s][A
 44% 220/500 [03:10<03:51,  1.21it/s][A
 44% 221/500 [03:11<03:37,  1.28it/s][A
 44% 222/500 [03:11<03:41,  1.26it/s][A
 45% 223/500 [03:12<03:40,  1.26it/s][A
 45% 224/500 [03:13<03:51,  1.19it/s][A
 45% 225/500 [03:14<04:00,  1.15it/s][A
 45% 226/500 [03:15<04:00,  1.14it/s][A
 45% 227/500 [03:16<04:04,  1.12it/s][A
 46% 228/500 [03:17<03:50,  1.18it/s][A
 46% 229/500 [03:17<03:37,  1.25it/s][A
 46% 230/500 [03:18<03:44,  1.20it/s][A
 46% 231/500 [03:19<03:41,  1.22it/s][A
 46% 232/500 [03:20<03:48,  1.17it/s][A
 47% 233/500 [03:21<03:55,  1.13it/s][A
 47% 234/500 [03:22<03:53,  1.14it/s][A
 47% 235/500 [03:23<03:56,  1.12it/s][A
 47% 236/500 [03:23<03:42,  1.18it/s][A
 47% 237/500 [03:24<03:42,  1.18it/s][A
 48% 238/500 [03:25<03:48,  1.15it/s][A
 48% 239/500 [03:26<03:45,  1.16it/s][A
 48% 240/500 [03:27<03:51,  1.12it/s][A
 48% 241/500 [03:28<03:47,  1.14it/s][A
 48% 242/500 [03:29<03:47,  1.13it/s][A
 49% 243/500 [03:30<03:45,  1.14it/s][A
 49% 244/500 [03:30<03:41,  1.16it/s][A
 49% 245/500 [03:31<03:46,  1.13it/s][A
 49% 246/500 [03:32<03:48,  1.11it/s][A
 49% 247/500 [03:33<03:50,  1.10it/s][A
 50% 248/500 [03:34<03:50,  1.09it/s][A
 50% 249/500 [03:35<03:48,  1.10it/s][A
 50% 250/500 [03:36<03:47,  1.10it/s][A
 50% 251/500 [03:37<03:42,  1.12it/s][A
 50% 252/500 [03:38<03:32,  1.17it/s][A
 51% 253/500 [03:38<03:24,  1.21it/s][A
 51% 254/500 [03:39<03:26,  1.19it/s][A
 51% 255/500 [03:40<03:28,  1.17it/s][A
 51% 256/500 [03:41<03:25,  1.19it/s][A
 51% 257/500 [03:42<03:28,  1.17it/s][A
 52% 258/500 [03:43<03:26,  1.17it/s][A
 52% 259/500 [03:44<03:27,  1.16it/s][A
 52% 260/500 [03:44<03:20,  1.20it/s][A
 52% 261/500 [03:45<03:18,  1.20it/s][A
 52% 262/500 [03:46<03:19,  1.19it/s][A
 53% 263/500 [03:47<03:21,  1.18it/s][A
 53% 264/500 [03:48<03:22,  1.17it/s][A
 53% 265/500 [03:49<03:15,  1.20it/s][A
 53% 266/500 [03:49<03:19,  1.17it/s][A
 53% 267/500 [03:50<03:19,  1.17it/s][A
 54% 268/500 [03:51<03:14,  1.19it/s][A
 54% 269/500 [03:52<03:12,  1.20it/s][A
 54% 270/500 [03:53<03:19,  1.15it/s][A
 54% 271/500 [03:54<03:08,  1.21it/s][A
 54% 272/500 [03:54<03:09,  1.20it/s][A
 55% 273/500 [03:55<03:11,  1.19it/s][A
 55% 274/500 [03:56<03:07,  1.21it/s][A
 55% 275/500 [03:57<03:15,  1.15it/s][A
 55% 276/500 [03:58<03:08,  1.19it/s][A
 55% 277/500 [03:59<03:06,  1.20it/s][A
 56% 278/500 [04:00<03:12,  1.15it/s][A
 56% 279/500 [04:00<03:10,  1.16it/s][A
 56% 280/500 [04:01<03:15,  1.13it/s][A
 56% 281/500 [04:02<03:14,  1.13it/s][A
 56% 282/500 [04:03<03:12,  1.13it/s][A
 57% 283/500 [04:04<03:14,  1.12it/s][A
 57% 284/500 [04:05<03:08,  1.15it/s][A
 57% 285/500 [04:06<03:09,  1.14it/s][A
 57% 286/500 [04:07<03:07,  1.14it/s][A
 57% 287/500 [04:08<03:04,  1.15it/s][A
 58% 288/500 [04:08<03:04,  1.15it/s][A
 58% 289/500 [04:09<03:02,  1.15it/s][A
 58% 290/500 [04:10<02:58,  1.18it/s][A
 58% 291/500 [04:11<03:01,  1.15it/s][A
 58% 292/500 [04:12<03:04,  1.13it/s][A
 59% 293/500 [04:13<03:03,  1.13it/s][A
 59% 294/500 [04:14<03:05,  1.11it/s][A
 59% 295/500 [04:15<03:01,  1.13it/s][A
 59% 296/500 [04:15<03:00,  1.13it/s][A
 59% 297/500 [04:16<02:53,  1.17it/s][A
 60% 298/500 [04:17<02:50,  1.19it/s][A
 60% 299/500 [04:18<02:56,  1.14it/s][A
 60% 300/500 [04:19<02:59,  1.12it/s][A
 60% 301/500 [04:20<02:47,  1.19it/s][A
 60% 302/500 [04:21<02:48,  1.17it/s][A
 61% 303/500 [04:21<02:48,  1.17it/s][A
 61% 304/500 [04:22<02:42,  1.21it/s][A
 61% 305/500 [04:23<02:46,  1.17it/s][A
 61% 306/500 [04:24<02:43,  1.19it/s][A
 61% 307/500 [04:25<02:38,  1.22it/s][A
 62% 308/500 [04:26<02:42,  1.18it/s][A
 62% 309/500 [04:26<02:43,  1.17it/s][A
 62% 310/500 [04:27<02:46,  1.14it/s][A
 62% 311/500 [04:28<02:48,  1.12it/s][A
 62% 312/500 [04:29<02:47,  1.13it/s][A
 63% 313/500 [04:30<02:38,  1.18it/s][A
 63% 314/500 [04:31<02:36,  1.19it/s][A
 63% 315/500 [04:32<02:40,  1.15it/s][A
 63% 316/500 [04:33<02:44,  1.12it/s][A
 63% 317/500 [04:34<02:41,  1.13it/s][A
 64% 318/500 [04:34<02:33,  1.19it/s][A
 64% 319/500 [04:35<02:32,  1.18it/s][A
 64% 320/500 [04:36<02:30,  1.20it/s][A
 64% 321/500 [04:37<02:35,  1.15it/s][A
 64% 322/500 [04:38<02:34,  1.16it/s][A
 65% 323/500 [04:39<02:33,  1.15it/s][A
 65% 324/500 [04:39<02:23,  1.23it/s][A
 65% 325/500 [04:40<02:29,  1.17it/s][A
 65% 326/500 [04:41<02:28,  1.17it/s][A
 65% 327/500 [04:42<02:30,  1.15it/s][A
 66% 328/500 [04:43<02:29,  1.15it/s][A
 66% 329/500 [04:44<02:29,  1.14it/s][A
 66% 330/500 [04:45<02:27,  1.15it/s][A
 66% 331/500 [04:46<02:29,  1.13it/s][A
 66% 332/500 [04:46<02:30,  1.11it/s][A
 67% 333/500 [04:47<02:32,  1.09it/s][A
 67% 334/500 [04:48<02:33,  1.08it/s][A
 67% 335/500 [04:49<02:32,  1.08it/s][A
 67% 336/500 [04:50<02:30,  1.09it/s][A
 67% 337/500 [04:51<02:30,  1.08it/s][A
 68% 338/500 [04:52<02:23,  1.13it/s][A
 68% 339/500 [04:53<02:23,  1.12it/s][A
 68% 340/500 [04:54<02:24,  1.11it/s][A
 68% 341/500 [04:55<02:24,  1.10it/s][A
 68% 342/500 [04:56<02:20,  1.13it/s][A
 69% 343/500 [04:56<02:13,  1.18it/s][A
 69% 344/500 [04:57<02:06,  1.24it/s][A
 69% 345/500 [04:58<02:04,  1.24it/s][A
 69% 346/500 [04:59<02:09,  1.19it/s][A
 69% 347/500 [05:00<02:11,  1.16it/s][A
 70% 348/500 [05:00<02:10,  1.17it/s][A
 70% 349/500 [05:01<02:13,  1.13it/s][A
 70% 350/500 [05:02<02:14,  1.11it/s][A
 70% 351/500 [05:03<02:15,  1.10it/s][A
 70% 352/500 [05:04<02:15,  1.09it/s][A
 71% 353/500 [05:05<02:15,  1.08it/s][A
 71% 354/500 [05:06<02:14,  1.08it/s][A
 71% 355/500 [05:07<02:14,  1.08it/s][A
 71% 356/500 [05:08<02:09,  1.11it/s][A
 71% 357/500 [05:09<02:07,  1.13it/s][A
 72% 358/500 [05:10<02:06,  1.13it/s][A
 72% 359/500 [05:11<02:07,  1.11it/s][A
 72% 360/500 [05:11<02:06,  1.10it/s][A
 72% 361/500 [05:12<02:02,  1.13it/s][A
 72% 362/500 [05:13<01:59,  1.15it/s][A
 73% 363/500 [05:14<01:53,  1.20it/s][A
 73% 364/500 [05:15<01:58,  1.15it/s][A
 73% 365/500 [05:16<01:59,  1.13it/s][A
 73% 366/500 [05:17<01:59,  1.12it/s][A
 73% 367/500 [05:18<01:58,  1.12it/s][A
 74% 368/500 [05:18<01:58,  1.11it/s][A
 74% 369/500 [05:19<01:59,  1.10it/s][A
 74% 370/500 [05:20<01:52,  1.16it/s][A
 74% 371/500 [05:21<01:54,  1.12it/s][A
 74% 372/500 [05:22<01:49,  1.17it/s][A
 75% 373/500 [05:23<01:50,  1.15it/s][A
 75% 374/500 [05:24<01:49,  1.15it/s][A
 75% 375/500 [05:25<01:51,  1.12it/s][A
 75% 376/500 [05:26<01:52,  1.10it/s][A
 75% 377/500 [05:26<01:45,  1.17it/s][A
 76% 378/500 [05:27<01:42,  1.19it/s][A
 76% 379/500 [05:28<01:45,  1.15it/s][A
 76% 380/500 [05:29<01:46,  1.13it/s][A
 76% 381/500 [05:30<01:47,  1.11it/s][A
 76% 382/500 [05:31<01:46,  1.10it/s][A
 77% 383/500 [05:32<01:47,  1.09it/s][A
 77% 384/500 [05:33<01:45,  1.10it/s][A
 77% 385/500 [05:34<01:45,  1.09it/s][A
 77% 386/500 [05:34<01:41,  1.12it/s][A
 77% 387/500 [05:35<01:42,  1.10it/s][A
 78% 388/500 [05:36<01:38,  1.14it/s][A
 78% 389/500 [05:37<01:38,  1.12it/s][A
 78% 390/500 [05:38<01:37,  1.13it/s][A
 78% 391/500 [05:39<01:38,  1.11it/s][A
 78% 392/500 [05:40<01:34,  1.14it/s][A
 79% 393/500 [05:41<01:33,  1.15it/s][A
 79% 394/500 [05:41<01:34,  1.12it/s][A
 79% 395/500 [05:42<01:35,  1.10it/s][A
 79% 396/500 [05:43<01:32,  1.13it/s][A
 79% 397/500 [05:44<01:26,  1.19it/s][A
 80% 398/500 [05:45<01:29,  1.14it/s][A
 80% 399/500 [05:46<01:25,  1.18it/s][A
 80% 400/500 [05:47<01:24,  1.18it/s][A
 80% 401/500 [05:47<01:20,  1.22it/s][A
 80% 402/500 [05:48<01:23,  1.18it/s][A
 81% 403/500 [05:49<01:17,  1.24it/s][A
 81% 404/500 [05:50<01:15,  1.27it/s][A
 81% 405/500 [05:50<01:13,  1.29it/s][A
 81% 406/500 [05:51<01:13,  1.28it/s][A
 81% 407/500 [05:52<01:16,  1.22it/s][A
 82% 408/500 [05:53<01:11,  1.29it/s][A
 82% 409/500 [05:53<01:06,  1.36it/s][A
 82% 410/500 [05:54<01:08,  1.32it/s][A
 82% 411/500 [05:55<01:07,  1.31it/s][A
 82% 412/500 [05:56<01:05,  1.35it/s][A
 83% 413/500 [05:56<01:04,  1.35it/s][A
 83% 414/500 [05:57<01:06,  1.30it/s][A
 83% 415/500 [05:58<01:07,  1.27it/s][A
 83% 416/500 [05:59<01:07,  1.25it/s][A
 83% 417/500 [06:00<01:07,  1.23it/s][A
 84% 418/500 [06:01<01:09,  1.19it/s][A
 84% 419/500 [06:02<01:06,  1.22it/s][A
 84% 420/500 [06:02<01:02,  1.28it/s][A
 84% 421/500 [06:03<01:03,  1.25it/s][A
 84% 422/500 [06:04<01:00,  1.30it/s][A
 85% 423/500 [06:05<00:58,  1.31it/s][A
 85% 424/500 [06:05<00:57,  1.31it/s][A
 85% 425/500 [06:06<00:57,  1.31it/s][A
 85% 426/500 [06:07<00:56,  1.31it/s][A
 85% 427/500 [06:08<00:57,  1.27it/s][A
 86% 428/500 [06:09<00:58,  1.22it/s][A
 86% 429/500 [06:09<00:56,  1.26it/s][A
 86% 430/500 [06:10<00:56,  1.24it/s][A
 86% 431/500 [06:11<00:54,  1.26it/s][A
 86% 432/500 [06:12<00:52,  1.29it/s][A
 87% 433/500 [06:12<00:52,  1.29it/s][A
 87% 434/500 [06:13<00:47,  1.38it/s][A
 87% 435/500 [06:14<00:47,  1.37it/s][A
 87% 436/500 [06:15<00:48,  1.32it/s][A
 87% 437/500 [06:15<00:47,  1.32it/s][A
 88% 438/500 [06:16<00:48,  1.28it/s][A
 88% 439/500 [06:17<00:45,  1.34it/s][A
 88% 440/500 [06:18<00:46,  1.28it/s][A
 88% 441/500 [06:18<00:41,  1.42it/s][A
 88% 442/500 [06:19<00:43,  1.34it/s][A
 89% 443/500 [06:20<00:43,  1.32it/s][A
 89% 444/500 [06:21<00:43,  1.28it/s][A
 89% 445/500 [06:22<00:45,  1.22it/s][A
 89% 446/500 [06:22<00:42,  1.28it/s][A
 89% 447/500 [06:23<00:40,  1.32it/s][A
 90% 448/500 [06:24<00:37,  1.39it/s][A
 90% 449/500 [06:24<00:38,  1.34it/s][A
 90% 450/500 [06:25<00:39,  1.27it/s][A
 90% 451/500 [06:26<00:38,  1.26it/s][A
 90% 452/500 [06:27<00:39,  1.20it/s][A
 91% 453/500 [06:28<00:40,  1.16it/s][A
 91% 454/500 [06:29<00:39,  1.16it/s][A
 91% 455/500 [06:30<00:40,  1.12it/s][A
 91% 456/500 [06:31<00:39,  1.10it/s][A
 91% 457/500 [06:32<00:39,  1.10it/s][A
 92% 458/500 [06:32<00:37,  1.13it/s][A
 92% 459/500 [06:33<00:36,  1.13it/s][A
 92% 460/500 [06:34<00:35,  1.13it/s][A
 92% 461/500 [06:35<00:35,  1.10it/s][A
 92% 462/500 [06:36<00:33,  1.12it/s][A
 93% 463/500 [06:37<00:31,  1.19it/s][A
 93% 464/500 [06:38<00:29,  1.21it/s][A
 93% 465/500 [06:38<00:29,  1.19it/s][A
 93% 466/500 [06:39<00:28,  1.20it/s][A
 93% 467/500 [06:40<00:28,  1.15it/s][A
 94% 468/500 [06:41<00:27,  1.16it/s][A
 94% 469/500 [06:42<00:26,  1.15it/s][A
 94% 470/500 [06:43<00:26,  1.13it/s][A
 94% 471/500 [06:44<00:25,  1.12it/s][A
 94% 472/500 [06:45<00:25,  1.10it/s][A
 95% 473/500 [06:46<00:24,  1.08it/s][A
 95% 474/500 [06:47<00:23,  1.10it/s][A
 95% 475/500 [06:47<00:22,  1.10it/s][A
 95% 476/500 [06:48<00:21,  1.09it/s][A
 95% 477/500 [06:49<00:20,  1.13it/s][A
 96% 478/500 [06:50<00:19,  1.13it/s][A
 96% 479/500 [06:51<00:18,  1.15it/s][A
 96% 480/500 [06:52<00:17,  1.14it/s][A
 96% 481/500 [06:53<00:16,  1.14it/s][A
 96% 482/500 [06:54<00:16,  1.12it/s][A
 97% 483/500 [06:54<00:15,  1.12it/s][A
 97% 484/500 [06:55<00:13,  1.17it/s][A
 97% 485/500 [06:56<00:13,  1.13it/s][A
 97% 486/500 [06:57<00:12,  1.16it/s][A
 97% 487/500 [06:58<00:11,  1.16it/s][A
 98% 488/500 [06:59<00:10,  1.17it/s][A
 98% 489/500 [06:59<00:09,  1.21it/s][A
 98% 490/500 [07:00<00:08,  1.22it/s][A
 98% 491/500 [07:01<00:07,  1.20it/s][A
 98% 492/500 [07:02<00:06,  1.21it/s][A
 99% 493/500 [07:03<00:05,  1.20it/s][A
 99% 494/500 [07:04<00:05,  1.19it/s][A
 99% 495/500 [07:05<00:04,  1.17it/s][A
 99% 496/500 [07:05<00:03,  1.14it/s][A
 99% 497/500 [07:06<00:02,  1.11it/s][A
100% 498/500 [07:07<00:01,  1.14it/s][A
100% 499/500 [07:08<00:00,  1.12it/s][A
100% 500/500 [07:09<00:00,  1.10it/s][A                                     
                                     [A 80% 200/250 [22:38<02:01,  2.42s/it]
100% 500/500 [07:09<00:00,  1.10it/s][A
                                     [A 80% 201/250 [22:41<1:47:32, 131.68s/it] 81% 202/250 [22:44<1:14:21, 92.94s/it]  81% 203/250 [22:46<51:30, 65.76s/it]   82% 204/250 [22:48<35:48, 46.72s/it] 82% 205/250 [22:51<25:01, 33.37s/it] 82% 206/250 [22:53<17:40, 24.11s/it] 83% 207/250 [22:56<12:38, 17.63s/it] 83% 208/250 [22:58<09:08, 13.06s/it] 84% 209/250 [23:00<06:43,  9.84s/it] 84% 210/250 [23:03<05:05,  7.64s/it]                                      84% 210/250 [23:03<05:05,  7.64s/it] 84% 211/250 [23:05<03:55,  6.03s/it] 85% 212/250 [23:08<03:09,  4.98s/it] 85% 213/250 [23:10<02:33,  4.16s/it] 86% 214/250 [23:12<02:11,  3.65s/it] 86% 215/250 [23:15<01:56,  3.32s/it] 86% 216/250 [23:17<01:44,  3.08s/it] 87% 217/250 [23:20<01:37,  2.94s/it] 87% 218/250 [23:22<01:27,  2.75s/it] 88% 219/250 [23:25<01:22,  2.66s/it] 88% 220/250 [23:27<01:19,  2.65s/it]                                      88% 220/250 [23:27<01:19,  2.65s/it] 88% 221/250 [23:30<01:14,  2.58s/it] 89% 222/250 [23:32<01:09,  2.50s/it] 89% 223/250 [23:35<01:07,  2.50s/it] 90% 224/250 [23:37<01:05,  2.53s/it] 90% 225/250 [23:40<01:02,  2.52s/it] 90% 226/250 [23:42<01:00,  2.50s/it] 91% 227/250 [23:45<00:58,  2.53s/it] 91% 228/250 [23:48<00:57,  2.61s/it] 92% 229/250 [23:50<00:52,  2.49s/it] 92% 230/250 [23:52<00:49,  2.49s/it]                                      92% 230/250 [23:52<00:49,  2.49s/it] 92% 231/250 [23:55<00:47,  2.49s/it] 93% 232/250 [23:57<00:44,  2.49s/it] 93% 233/250 [24:00<00:42,  2.49s/it] 94% 234/250 [24:02<00:38,  2.44s/it] 94% 235/250 [24:04<00:36,  2.40s/it] 94% 236/250 [24:07<00:33,  2.40s/it] 95% 237/250 [24:09<00:32,  2.46s/it] 95% 238/250 [24:12<00:28,  2.37s/it] 96% 239/250 [24:14<00:25,  2.34s/it] 96% 240/250 [24:16<00:23,  2.35s/it]                                      96% 240/250 [24:16<00:23,  2.35s/it] 96% 241/250 [24:19<00:22,  2.46s/it] 97% 242/250 [24:21<00:20,  2.50s/it] 97% 243/250 [24:24<00:17,  2.50s/it] 98% 244/250 [24:26<00:14,  2.48s/it] 98% 245/250 [24:29<00:12,  2.48s/it] 98% 246/250 [24:31<00:09,  2.43s/it] 99% 247/250 [24:33<00:07,  2.39s/it] 99% 248/250 [24:36<00:04,  2.45s/it]100% 249/250 [24:39<00:02,  2.51s/it]100% 250/250 [24:41<00:00,  2.44s/it]                                     100% 250/250 [24:41<00:00,  2.44s/it]Saving model checkpoint to models/facebook_wav2vec2-large_NEW_GENDER_/checkpoint-250
Configuration saved in models/facebook_wav2vec2-large_NEW_GENDER_/checkpoint-250/config.json
Model weights saved in models/facebook_wav2vec2-large_NEW_GENDER_/checkpoint-250/pytorch_model.bin
Feature extractor saved in models/facebook_wav2vec2-large_NEW_GENDER_/checkpoint-250/preprocessor_config.json
Deleting older checkpoint [models/facebook_wav2vec2-large_NEW_GENDER_/checkpoint-125] due to args.save_total_limit


Training completed. Do not forget to share your model on huggingface.co/models =)


                                     100% 250/250 [24:46<00:00,  2.44s/it]100% 250/250 [24:46<00:00,  5.95s/it]
Using custom data configuration default-4e4c237abd178dbd
Reusing dataset csv (/home/peterr/.cache/huggingface/datasets/csv/default-4e4c237abd178dbd/0.0.0/433e0ccc46f9880962cc2b12065189766fbb2bee57a221866138fb9203c83519)
  0% 0/1 [00:00<?, ?it/s]{'eval_loss': 0.6955100297927856, 'eval_accuracy': 0.5, 'eval_runtime': 430.5885, 'eval_samples_per_second': 4.645, 'eval_steps_per_second': 1.161, 'epoch': 1.6}
{'loss': 0.7271, 'learning_rate': 1.6000000000000003e-05, 'epoch': 1.68}
{'loss': 0.6998, 'learning_rate': 1.2e-05, 'epoch': 1.76}
{'loss': 0.7001, 'learning_rate': 8.000000000000001e-06, 'epoch': 1.84}
{'loss': 0.6671, 'learning_rate': 4.000000000000001e-06, 'epoch': 1.92}
{'loss': 0.7081, 'learning_rate': 0.0, 'epoch': 2.0}
{'train_runtime': 1493.662, 'train_samples_per_second': 1.339, 'train_steps_per_second': 0.167, 'train_loss': 0.7200160522460938, 'epoch': 2.0}
100% 1/1 [00:00<00:00, 861.43it/s]
loading configuration file models/facebook_wav2vec2-large_NEW_GENDER_/checkpoint-250/config.json
Model config Wav2Vec2Config {
  "_name_or_path": "models/facebook_wav2vec2-large_NEW_GENDER_/checkpoint-250",
  "activation_dropout": 0.1,
  "adapter_kernel_size": 3,
  "adapter_stride": 2,
  "add_adapter": false,
  "apply_spec_augment": true,
  "architectures": [
    "Wav2Vec2ForSpeechClassification"
  ],
  "attention_dropout": 0.1,
  "bos_token_id": 1,
  "classifier_proj_size": 256,
  "codevector_dim": 768,
  "contrastive_logits_temperature": 0.1,
  "conv_bias": false,
  "conv_dim": [
    512,
    512,
    512,
    512,
    512,
    512,
    512
  ],
  "conv_kernel": [
    10,
    3,
    3,
    3,
    3,
    2,
    2
  ],
  "conv_stride": [
    5,
    2,
    2,
    2,
    2,
    2,
    2
  ],
  "ctc_loss_reduction": "sum",
  "ctc_zero_infinity": false,
  "diversity_loss_weight": 0.1,
  "do_stable_layer_norm": false,
  "eos_token_id": 2,
  "feat_extract_activation": "gelu",
  "feat_extract_dropout": 0.0,
  "feat_extract_norm": "group",
  "feat_proj_dropout": 0.1,
  "feat_quantizer_dropout": 0.0,
  "final_dropout": 0.1,
  "finetuning_task": "wav2vec2_clf",
  "gradient_checkpointing": false,
  "hidden_act": "gelu",
  "hidden_dropout": 0.1,
  "hidden_dropout_prob": 0.1,
  "hidden_size": 1024,
  "id2label": {
    "0": "F",
    "1": "M"
  },
  "initializer_range": 0.02,
  "intermediate_size": 4096,
  "label2id": {
    "F": 0,
    "M": 1
  },
  "layer_norm_eps": 1e-05,
  "layerdrop": 0.1,
  "mask_feature_length": 10,
  "mask_feature_min_masks": 0,
  "mask_feature_prob": 0.0,
  "mask_time_length": 10,
  "mask_time_min_masks": 2,
  "mask_time_prob": 0.05,
  "model_type": "wav2vec2",
  "num_adapter_layers": 3,
  "num_attention_heads": 16,
  "num_codevector_groups": 2,
  "num_codevectors_per_group": 320,
  "num_conv_pos_embedding_groups": 16,
  "num_conv_pos_embeddings": 128,
  "num_feat_extract_layers": 7,
  "num_hidden_layers": 24,
  "num_negatives": 100,
  "output_hidden_size": 1024,
  "pad_token_id": 0,
  "pooling_mode": "mean",
  "problem_type": "single_label_classification",
  "proj_codevector_dim": 768,
  "tdnn_dilation": [
    1,
    2,
    3,
    1,
    1
  ],
  "tdnn_dim": [
    512,
    512,
    512,
    512,
    1500
  ],
  "tdnn_kernel": [
    5,
    3,
    3,
    1,
    1
  ],
  "torch_dtype": "float32",
  "transformers_version": "4.18.0",
  "use_weighted_layer_sum": false,
  "vocab_size": 32,
  "xvector_output_dim": 512
}

loading feature extractor configuration file models/facebook_wav2vec2-large_NEW_GENDER_/checkpoint-250/preprocessor_config.json
Feature extractor Wav2Vec2FeatureExtractor {
  "do_normalize": true,
  "feature_extractor_type": "Wav2Vec2FeatureExtractor",
  "feature_size": 1,
  "padding_side": "right",
  "padding_value": 0.0,
  "return_attention_mask": true,
  "sampling_rate": 16000
}

Could not locate the tokenizer configuration file, will try to use the model config instead.
loading configuration file models/facebook_wav2vec2-large_NEW_GENDER_/checkpoint-250/config.json
Model config Wav2Vec2Config {
  "_name_or_path": "models/facebook_wav2vec2-large_NEW_GENDER_/checkpoint-250",
  "activation_dropout": 0.1,
  "adapter_kernel_size": 3,
  "adapter_stride": 2,
  "add_adapter": false,
  "apply_spec_augment": true,
  "architectures": [
    "Wav2Vec2ForSpeechClassification"
  ],
  "attention_dropout": 0.1,
  "bos_token_id": 1,
  "classifier_proj_size": 256,
  "codevector_dim": 768,
  "contrastive_logits_temperature": 0.1,
  "conv_bias": false,
  "conv_dim": [
    512,
    512,
    512,
    512,
    512,
    512,
    512
  ],
  "conv_kernel": [
    10,
    3,
    3,
    3,
    3,
    2,
    2
  ],
  "conv_stride": [
    5,
    2,
    2,
    2,
    2,
    2,
    2
  ],
  "ctc_loss_reduction": "sum",
  "ctc_zero_infinity": false,
  "diversity_loss_weight": 0.1,
  "do_stable_layer_norm": false,
  "eos_token_id": 2,
  "feat_extract_activation": "gelu",
  "feat_extract_dropout": 0.0,
  "feat_extract_norm": "group",
  "feat_proj_dropout": 0.1,
  "feat_quantizer_dropout": 0.0,
  "final_dropout": 0.1,
  "finetuning_task": "wav2vec2_clf",
  "gradient_checkpointing": false,
  "hidden_act": "gelu",
  "hidden_dropout": 0.1,
  "hidden_dropout_prob": 0.1,
  "hidden_size": 1024,
  "id2label": {
    "0": "F",
    "1": "M"
  },
  "initializer_range": 0.02,
  "intermediate_size": 4096,
  "label2id": {
    "F": 0,
    "M": 1
  },
  "layer_norm_eps": 1e-05,
  "layerdrop": 0.1,
  "mask_feature_length": 10,
  "mask_feature_min_masks": 0,
  "mask_feature_prob": 0.0,
  "mask_time_length": 10,
  "mask_time_min_masks": 2,
  "mask_time_prob": 0.05,
  "model_type": "wav2vec2",
  "num_adapter_layers": 3,
  "num_attention_heads": 16,
  "num_codevector_groups": 2,
  "num_codevectors_per_group": 320,
  "num_conv_pos_embedding_groups": 16,
  "num_conv_pos_embeddings": 128,
  "num_feat_extract_layers": 7,
  "num_hidden_layers": 24,
  "num_negatives": 100,
  "output_hidden_size": 1024,
  "pad_token_id": 0,
  "pooling_mode": "mean",
  "problem_type": "single_label_classification",
  "proj_codevector_dim": 768,
  "tdnn_dilation": [
    1,
    2,
    3,
    1,
    1
  ],
  "tdnn_dim": [
    512,
    512,
    512,
    512,
    1500
  ],
  "tdnn_kernel": [
    5,
    3,
    3,
    1,
    1
  ],
  "torch_dtype": "float32",
  "transformers_version": "4.18.0",
  "use_weighted_layer_sum": false,
  "vocab_size": 32,
  "xvector_output_dim": 512
}

Didn't find file models/facebook_wav2vec2-large_NEW_GENDER_/checkpoint-250/vocab.json. We won't load it.
Didn't find file models/facebook_wav2vec2-large_NEW_GENDER_/checkpoint-250/tokenizer_config.json. We won't load it.
Didn't find file models/facebook_wav2vec2-large_NEW_GENDER_/checkpoint-250/added_tokens.json. We won't load it.
Didn't find file models/facebook_wav2vec2-large_NEW_GENDER_/checkpoint-250/special_tokens_map.json. We won't load it.
/home/peterr/anaconda3/lib/python3.8/site-packages/transformers/models/wav2vec2/processing_wav2vec2.py:52: FutureWarning: Loading a tokenizer inside Wav2Vec2Processor from a config that does not include a `tokenizer_class` attribute is deprecated and will be removed in v5. Please add `'tokenizer_class': 'Wav2Vec2CTCTokenizer'` attribute to either your `config.json` or `tokenizer_config.json` file to suppress this warning: 
  warnings.warn(
loading feature extractor configuration file models/facebook_wav2vec2-large_NEW_GENDER_/checkpoint-250/preprocessor_config.json
Feature extractor Wav2Vec2FeatureExtractor {
  "do_normalize": true,
  "feature_extractor_type": "Wav2Vec2FeatureExtractor",
  "feature_size": 1,
  "padding_side": "right",
  "padding_value": 0.0,
  "return_attention_mask": true,
  "sampling_rate": 16000
}

Didn't find file models/facebook_wav2vec2-large_NEW_GENDER_/checkpoint-250/vocab.json. We won't load it.
Didn't find file models/facebook_wav2vec2-large_NEW_GENDER_/checkpoint-250/tokenizer_config.json. We won't load it.
Didn't find file models/facebook_wav2vec2-large_NEW_GENDER_/checkpoint-250/added_tokens.json. We won't load it.
Didn't find file models/facebook_wav2vec2-large_NEW_GENDER_/checkpoint-250/special_tokens_map.json. We won't load it.
Didn't find file ./tokenizer_config.json. We won't load it.
Didn't find file ./added_tokens.json. We won't load it.
Didn't find file ./special_tokens_map.json. We won't load it.
loading file ./vocab.json
loading file None
loading file None
loading file None
Adding <s> to the vocabulary
Adding </s> to the vocabulary
Special tokens have been added in the vocabulary, make sure the associated word embeddings are fine-tuned or trained.
loading configuration file models/facebook_wav2vec2-large_NEW_GENDER_/checkpoint-250/config.json
Model config Wav2Vec2Config {
  "_name_or_path": "facebook/wav2vec2-large",
  "activation_dropout": 0.1,
  "adapter_kernel_size": 3,
  "adapter_stride": 2,
  "add_adapter": false,
  "apply_spec_augment": true,
  "architectures": [
    "Wav2Vec2ForSpeechClassification"
  ],
  "attention_dropout": 0.1,
  "bos_token_id": 1,
  "classifier_proj_size": 256,
  "codevector_dim": 768,
  "contrastive_logits_temperature": 0.1,
  "conv_bias": false,
  "conv_dim": [
    512,
    512,
    512,
    512,
    512,
    512,
    512
  ],
  "conv_kernel": [
    10,
    3,
    3,
    3,
    3,
    2,
    2
  ],
  "conv_stride": [
    5,
    2,
    2,
    2,
    2,
    2,
    2
  ],
  "ctc_loss_reduction": "sum",
  "ctc_zero_infinity": false,
  "diversity_loss_weight": 0.1,
  "do_stable_layer_norm": false,
  "eos_token_id": 2,
  "feat_extract_activation": "gelu",
  "feat_extract_dropout": 0.0,
  "feat_extract_norm": "group",
  "feat_proj_dropout": 0.1,
  "feat_quantizer_dropout": 0.0,
  "final_dropout": 0.1,
  "finetuning_task": "wav2vec2_clf",
  "gradient_checkpointing": false,
  "hidden_act": "gelu",
  "hidden_dropout": 0.1,
  "hidden_dropout_prob": 0.1,
  "hidden_size": 1024,
  "id2label": {
    "0": "F",
    "1": "M"
  },
  "initializer_range": 0.02,
  "intermediate_size": 4096,
  "label2id": {
    "F": 0,
    "M": 1
  },
  "layer_norm_eps": 1e-05,
  "layerdrop": 0.1,
  "mask_feature_length": 10,
  "mask_feature_min_masks": 0,
  "mask_feature_prob": 0.0,
  "mask_time_length": 10,
  "mask_time_min_masks": 2,
  "mask_time_prob": 0.05,
  "model_type": "wav2vec2",
  "num_adapter_layers": 3,
  "num_attention_heads": 16,
  "num_codevector_groups": 2,
  "num_codevectors_per_group": 320,
  "num_conv_pos_embedding_groups": 16,
  "num_conv_pos_embeddings": 128,
  "num_feat_extract_layers": 7,
  "num_hidden_layers": 24,
  "num_negatives": 100,
  "output_hidden_size": 1024,
  "pad_token_id": 0,
  "pooling_mode": "mean",
  "problem_type": "single_label_classification",
  "proj_codevector_dim": 768,
  "tdnn_dilation": [
    1,
    2,
    3,
    1,
    1
  ],
  "tdnn_dim": [
    512,
    512,
    512,
    512,
    1500
  ],
  "tdnn_kernel": [
    5,
    3,
    3,
    1,
    1
  ],
  "torch_dtype": "float32",
  "transformers_version": "4.18.0",
  "use_weighted_layer_sum": false,
  "vocab_size": 32,
  "xvector_output_dim": 512
}

loading weights file models/facebook_wav2vec2-large_NEW_GENDER_/checkpoint-250/pytorch_model.bin
All model checkpoint weights were used when initializing Wav2Vec2ForSpeechClassification.

All the weights of Wav2Vec2ForSpeechClassification were initialized from the model checkpoint at models/facebook_wav2vec2-large_NEW_GENDER_/checkpoint-250.
If your task is similar to the task the model of the checkpoint was trained on, you can already use Wav2Vec2ForSpeechClassification for predictions without further training.
Loading cached processed dataset at /home/peterr/.cache/huggingface/datasets/csv/default-4e4c237abd178dbd/0.0.0/433e0ccc46f9880962cc2b12065189766fbb2bee57a221866138fb9203c83519/cache-88f43f5345a6720b.arrow
Parameter 'function'=<function eval_model.<locals>.predict at 0x7f7bd9aa2f70> of the transform datasets.arrow_dataset.Dataset._map_single couldn't be hashed properly, a random hash was used instead. Make sure your transforms and parameters are serializable with pickle or dill for the dataset fingerprinting and caching to work. If you reuse this transform, the caching mechanism will consider it to be different from the previous calls and recompute everything. This warning is only showed once. Subsequent hashing failures won't be showed.
Loading cached processed dataset at /home/peterr/.cache/huggingface/datasets/csv/default-4e4c237abd178dbd/0.0.0/433e0ccc46f9880962cc2b12065189766fbb2bee57a221866138fb9203c83519/cache-1c80317fa3b1799d.arrow
Traceback (most recent call last):
  File "010_script_for_new_checkpoint.py", line 59, in <module>
    df.to_json("010_results.jsonl", origin="records", lines=True)
TypeError: to_json() got an unexpected keyword argument 'origin'
wandb: Waiting for W&B process to finish... (failed 1). Press Control-C to abort syncing.
wandb: - 0.001 MB of 0.001 MB uploaded (0.000 MB deduped)wandb: \ 0.001 MB of 0.001 MB uploaded (0.000 MB deduped)wandb: | 0.001 MB of 0.001 MB uploaded (0.000 MB deduped)wandb: / 0.001 MB of 0.837 MB uploaded (0.000 MB deduped)wandb: - 0.001 MB of 0.853 MB uploaded (0.000 MB deduped)wandb: \ 0.001 MB of 0.853 MB uploaded (0.000 MB deduped)wandb: | 0.001 MB of 0.853 MB uploaded (0.000 MB deduped)wandb: / 0.837 MB of 0.853 MB uploaded (0.000 MB deduped)wandb: - 0.837 MB of 0.853 MB uploaded (0.000 MB deduped)wandb: \ 0.837 MB of 0.853 MB uploaded (0.000 MB deduped)wandb: | 0.837 MB of 0.853 MB uploaded (0.000 MB deduped)wandb: / 0.837 MB of 0.853 MB uploaded (0.000 MB deduped)wandb: - 0.853 MB of 0.853 MB uploaded (0.000 MB deduped)wandb: \ 0.853 MB of 0.853 MB uploaded (0.000 MB deduped)wandb: | 0.853 MB of 0.853 MB uploaded (0.000 MB deduped)wandb: / 0.853 MB of 0.853 MB uploaded (0.000 MB deduped)wandb: - 0.853 MB of 0.853 MB uploaded (0.000 MB deduped)wandb: \ 0.853 MB of 0.853 MB uploaded (0.000 MB deduped)wandb: | 0.853 MB of 0.853 MB uploaded (0.000 MB deduped)wandb: / 0.853 MB of 0.853 MB uploaded (0.000 MB deduped)wandb:                                                                                
wandb: 
wandb: Run history:
wandb:                  eval/accuracy ▁▁
wandb:                      eval/loss █▁
wandb:                   eval/runtime █▁
wandb:        eval/samples_per_second ▁█
wandb:          eval/steps_per_second ▁█
wandb:                    train/epoch ▁▁▂▂▂▂▃▃▃▄▄▄▄▄▅▅▅▆▆▆▇▇▇▇▇███
wandb:              train/global_step ▁▁▂▂▂▂▃▃▃▄▄▄▄▅▅▅▅▆▆▆▇▇▇▇▇███
wandb:            train/learning_rate ██▇▇▇▇▆▆▆▅▅▅▅▄▄▄▃▃▃▂▂▂▂▁▁
wandb:                     train/loss ▄▅█▆▇▅▃▃▃▃▁▆▂▄▃▂▃▃▄▂▄▃▃▁▃
wandb:               train/total_flos ▁
wandb:               train/train_loss ▁
wandb:            train/train_runtime ▁
wandb: train/train_samples_per_second ▁
wandb:   train/train_steps_per_second ▁
wandb: 
wandb: Run summary:
wandb:                  eval/accuracy 0.5
wandb:                      eval/loss 0.69551
wandb:                   eval/runtime 430.5885
wandb:        eval/samples_per_second 4.645
wandb:          eval/steps_per_second 1.161
wandb:                    train/epoch 2.0
wandb:              train/global_step 250
wandb:            train/learning_rate 0.0
wandb:                     train/loss 0.7081
wandb:               train/total_flos 1.2000224064954824e+18
wandb:               train/train_loss 0.72002
wandb:            train/train_runtime 1493.662
wandb: train/train_samples_per_second 1.339
wandb:   train/train_steps_per_second 0.167
wandb: 
wandb: Synced models/facebook_wav2vec2-large_NEW_GENDER_: https://wandb.ai/5roop/huggingface/runs/bh84dpe3
wandb: Synced 6 W&B file(s), 0 media file(s), 0 artifact file(s) and 0 other file(s)
wandb: Find logs at: ./wandb/run-20220517_161922-bh84dpe3/logs
